0,DO YOU THINK HE WOULD *,*,*,<srai>would he <star/></srai>,reduction3.safe.aiml
0,I WONDER WOULD *,*,*,<srai>would <star/></srai>,reduction3.safe.aiml
0,WOULD NOT *,*,*,<srai>would <star/></srai>,reduction3.safe.aiml
0,THAT IS WONDERFUL,*,*,<srai>wonderful</srai>,reduction3.safe.aiml
0,IT IS NOT AGREED THAT WOMEN CAN *,*,*,<srai>Women can not <star/></srai>,reduction3.safe.aiml
0,IT IS NOT AGREED THAT WOMEN *,*,*,<srai>Women are not <star/></srai>,reduction3.safe.aiml
0,WOMAN AND *,*,*,<srai>woman</srai>.     <srai>  <star/></srai>,reduction3.safe.aiml
0,ONLY WITH *,*,*,<srai>with <star/></srai>,reduction3.safe.aiml
0,* WILL YOU REMEMBER MY NAME,*,*,<srai>will you remember my name</srai>,reduction3.safe.aiml
0,* WILL YOU REMEMBER ME,*,*,<srai>WILL YOU REMEMBER ME</srai>,reduction3.safe.aiml
0,DO YOU WANT TO MARRY ME,*,*,<srai>will you marry me</srai>,reduction3.safe.aiml
0,I WANT TO MARRY YOU,*,*,<srai>will you marry me</srai>,reduction3.safe.aiml
0,MARRY ME,*,*,<srai>will you marry me</srai>,reduction3.safe.aiml
0,YOU WILL MARRY ME,*,*,<srai>will you marry me</srai>,reduction3.safe.aiml
0,* WILL YOU MARRY ME,*,*,<srai>will you marry me</srai>,reduction3.safe.aiml
0,YOU WILL DIE,*,*,<srai>will you die</srai>,reduction3.safe.aiml
0,HAVE YOU CONSIDERED BECOMING *,*,*,<srai>will you become <star/></srai>,reduction3.safe.aiml
0,ARE YOU GOING TO BE *,*,*,<srai>will you be <star/></srai>,reduction3.safe.aiml
0,YOU WILL NOT _ WILL YOU,*,*,<srai>will you <star/></srai>,reduction3.safe.aiml
0,DO YOU THINK THAT ROBOTS WILL *,*,*,<srai>will you <star/></srai>,reduction3.safe.aiml
0,DO YOU THINK THAT YOU WILL *,*,*,<srai>will you <star/></srai>,reduction3.safe.aiml
0,DO YOU THINK YOU WILL *,*,*,<srai>will you <star/></srai>,reduction3.safe.aiml
0,WILL YOU EVER *,*,*,<srai>will you <star/></srai>,reduction3.safe.aiml
0,WILL YOU STILL *,*,*,<srai>will you <star/></srai>,reduction3.safe.aiml
0,DO YOU THINK A COMPUTER PROGRAM WILL *,*,*,<srai>will you <star/></srai>,reduction3.safe.aiml
0,DO YOU THINK A COMPUTER WILL *,*,*,<srai>will you <star/></srai>,reduction3.safe.aiml
0,DO YOU THINK COMPUTERS WILL *,*,*,<srai>will you <star/></srai>,reduction3.safe.aiml
0,IF YOU * WILL YOU *,*,*,<srai>will you <star index="2"/></srai>. <srai>you <star/></srai>,reduction3.safe.aiml
0,ARE WE GONNA *,*,*,<srai>will we <star/></srai>,reduction3.safe.aiml
0,DO YOU THINK WE WILL *,*,*,<srai>will we <star/></srai>,reduction3.safe.aiml
0,WILL WE EVER *,*,*,<srai>will we <star/></srai>,reduction3.safe.aiml
0,DO YOU THINK THIS WILL *,*,*,<srai>will this <star/></srai>,reduction3.safe.aiml
0,I WANT TO SEE IF IT WILL *,*,*,<srai>will it <star/></srai>,reduction3.safe.aiml
0,IS IT GOING TO *,*,*,<srai>will it <star/></srai>,reduction3.safe.aiml
0,DO YOU THINK IT WILL *,*,*,<srai>will it <star/></srai>,reduction3.safe.aiml
0,DO YOU THINK THAT IT WILL *,*,*,<srai>will it <star/></srai>,reduction3.safe.aiml
0,AM I GONNA *,*,*,<srai>will I <star/></srai>,reduction3.safe.aiml
0,DO YOU THINK I WILL *,*,*,<srai>will I <star/></srai>,reduction3.safe.aiml
0,DO YOU THINK THAT I WILL *,*,*,<srai>will I <star/></srai>,reduction3.safe.aiml
0,TELL ME IF I WILL *,*,*,<srai>will I <star/></srai>,reduction3.safe.aiml
0,WILL I DEFINITELY *,*,*,<srai>will I <star/></srai>,reduction3.safe.aiml
0,WILL I EVER *,*,*,<srai>will I <star/></srai>,reduction3.safe.aiml
0,IF I * WILL I *,*,*,<srai>will I <star index="2"/></srai>. <srai>I <star/></srai>,reduction3.safe.aiml
0,WILL _ FOR CHRISTMAS,*,*,<srai>WILL <star/></srai>,reduction3.safe.aiml
0,WILL NOT *,*,*,<srai>will <star/></srai>,reduction3.safe.aiml
0,WHEN I * WILL *,*,*,<srai>will <star index="2"/></srai>,reduction3.safe.aiml
0,WHY NOT,*,*,<srai>WHY</srai>,reduction3.safe.aiml
0,Y,*,*,<srai>WHY</srai>,reduction3.safe.aiml
0,BUT WHY,*,*,<srai>why</srai>,reduction3.safe.aiml
0,DO YOU KNOW WHY,*,*,<srai>why</srai>,reduction3.safe.aiml
0,FOR WHAT,*,*,<srai>why</srai>,reduction3.safe.aiml
0,HOW COME,*,*,<srai>why</srai>,reduction3.safe.aiml
0,HOWCOME,*,*,<srai>why</srai>,reduction3.safe.aiml
0,TELL ME WHY,*,*,<srai>why</srai>,reduction3.safe.aiml
0,TO WHAT,*,*,<srai>why</srai>,reduction3.safe.aiml
0,WHAT FOR,*,*,<srai>why</srai>,reduction3.safe.aiml
0,WHAT IS THE REASON,*,*,<srai>why</srai>,reduction3.safe.aiml
0,WHY IS THE *,*,*,<srai>why</srai>,reduction3.safe.aiml
0,WHY IS THIS,*,*,<srai>why</srai>,reduction3.safe.aiml
0,WHY SO,*,*,<srai>why</srai>,reduction3.safe.aiml
0,WHY THAT,*,*,<srai>why</srai>,reduction3.safe.aiml
0,WHY WHY,*,*,<srai>why</srai>,reduction3.safe.aiml
0,WHY WOULD NOT *,*,*,<srai>why would <star/></srai>,reduction3.safe.aiml
0,WHY WERE YOU ACTIVATED,*,*,<srai>why were you created</srai>,reduction3.safe.aiml
0,WHY WERE YOU BUILT,*,*,<srai>why were you created</srai>,reduction3.safe.aiml
0,WHY WERE YOU INVENTED,*,*,<srai>why were you created</srai>,reduction3.safe.aiml
0,WHY WERE YOU PROGRAMMED *,*,*,<srai>why were you created</srai>,reduction3.safe.aiml
0,WHY WERE YOU PROGRAMMED,*,*,<srai>why were you created</srai>,reduction3.safe.aiml
0,WHY DID YOU SAY SHE WAS *,*,*,<srai>why was she <star/></srai>,reduction3.safe.aiml
0,WHY ARE YOU SURPRISED,*,*,<srai>why surprised</srai>,reduction3.safe.aiml
0,WHY SHOULD I FUCKING *,*,*,<srai>why should I <star/></srai>,reduction3.safe.aiml
0,AND WHY NOT,*,*,<srai>why not</srai>,reduction3.safe.aiml
0,SURE WHY NOT,*,*,<srai>why not</srai>,reduction3.safe.aiml
0,WHYNOT,*,*,<srai>why not</srai>,reduction3.safe.aiml
0,WHY NOT JUST *,*,*,<srai>why not <star/></srai>,reduction3.safe.aiml
0,WHY NOT REAL *,*,*,<srai>why not <star/></srai>,reduction3.safe.aiml
0,WHY IS IT TWENTY THREE,*,*,<srai>why is twenty three the meaning of life</srai>,reduction3.safe.aiml
0,THE SKY IS BLUE,*,*,<srai>why is the sky blue</srai>,reduction3.safe.aiml
0,IS THAT BECAUSE *,*,*,<srai>why is that</srai>,reduction3.safe.aiml
0,WHY IS IT DANGEROUS *,*,*,<srai>why is it dangerous</srai>,reduction3.safe.aiml
0,WHY IS THE GRASS GREEN,*,*,<srai>why is grass green</srai>,reduction3.safe.aiml
0,WHY DO YOU LIKE THE COLOR *,*,*,<srai>why is <star/> your favorite color</srai>,reduction3.safe.aiml
0,DO YOU KNOW WHY * IS BLUE,*,*,<srai>why is <star/> blue</srai>,reduction3.safe.aiml
0,WHAT IS WHY *,*,*,<srai>why is <star/></srai>,reduction3.safe.aiml
0,WHY IS ONLY *,*,*,<srai>why is <star/></srai>,reduction3.safe.aiml
0,WHY IS THAT YOUR FAVORITE COLOR,*,*,<srai>why is <bot name="favoritecolor"/> your favorite color</srai>,reduction3.safe.aiml
0,WHY SHOULD YOU,*,*,<srai>why do you</srai>,reduction3.safe.aiml
0,WHY DO YOU WANT TO KNOW *,*,*,<srai>why do you want to know</srai>,reduction3.safe.aiml
0,WHY DO YOU CARE *,*,*,<srai>why do you care</srai>,reduction3.safe.aiml
0,WHY DO YOU REFER TO ME *,*,*,<srai>why do you call me <star/></srai>,reduction3.safe.aiml
0,WHY DID YOU ASK *,*,*,<srai>why do you ask</srai>,reduction3.safe.aiml
0,DO YOU KNOW WHY YOU *,*,*,<srai>why do you <star/></srai>,reduction3.safe.aiml
0,TELL ME WHY YOU *,*,*,<srai>why do you <star/></srai>,reduction3.safe.aiml
0,WHY DO YOU CONSTANTLY *,*,*,<srai>why do you <star/></srai>,reduction3.safe.aiml
0,WHY DO YOU OBVIOUSLY *,*,*,<srai>why do you <star/></srai>,reduction3.safe.aiml
0,WHY DO YOU ONLY *,*,*,<srai>why do you <star/></srai>,reduction3.safe.aiml
0,WHY DO I ALWAYS *,*,*,<srai>why do I <star/></srai>,reduction3.safe.aiml
0,THEN WHY DID YOU SAY IT,*,*,<srai>why did you say it</srai>,reduction3.safe.aiml
0,WHAT CAUSED YOU TO *,*,*,<srai>why did you <star/></srai>,reduction3.safe.aiml
0,WHY DID YOU JUST *,*,*,<srai>why did you <star/></srai>,reduction3.safe.aiml
0,WHY CAN NOT WE JUST *,*,*,<srai>why can not we <star/></srai>,reduction3.safe.aiml
0,WHY ARE YOU SURPRISED *,*,*,<srai>why are you surprised</srai>,reduction3.safe.aiml
0,WHY ARE YOU SMARTER,*,*,<srai>why are you smart</srai>,reduction3.safe.aiml
0,WHY ARE YOU SARCASTIC,*,*,<srai>why are you joking</srai>,reduction3.safe.aiml
0,WHY ARE YOU HAPPY,*,*,<srai>why are you good</srai>,reduction3.safe.aiml
0,WHY ARE YOU LIBERATED,*,*,<srai>why are you free</srai>,reduction3.safe.aiml
0,WHY ARE YOU SAD,*,*,<srai>why are you depressed</srai>,reduction3.safe.aiml
0,CURIOUS FOR WHAT,*,*,<srai>why are you curious</srai>,reduction3.safe.aiml
0,WHY ARE YOU * BLUE,*,*,<srai>why are you blue</srai>,reduction3.safe.aiml
0,WHY ARE YOU SO *,*,*,<srai>WHY ARE YOU <star/></srai>,reduction3.safe.aiml
0,DO YOU KNOW WHY YOU ARE *,*,*,<srai>why are you <star/></srai>,reduction3.safe.aiml
0,EXPLAIN WHY YOU ARE *,*,*,<srai>why are you <star/></srai>,reduction3.safe.aiml
0,TELL ME WHY YOU ARE *,*,*,<srai>why are you <star/></srai>,reduction3.safe.aiml
0,WHY ARE YOU ALWAYS *,*,*,<srai>why are you <star/></srai>,reduction3.safe.aiml
0,WHY ARE YOU BEING MEAN,*,*,<srai>why are you <star/></srai>,reduction3.safe.aiml
0,WHY ARE YOU EASILY *,*,*,<srai>why are you <star/></srai>,reduction3.safe.aiml
0,WHY ARE YOU HIGHLY *,*,*,<srai>why are you <star/></srai>,reduction3.safe.aiml
0,WHY ARE YOU JUST *,*,*,<srai>why are you <star/></srai>,reduction3.safe.aiml
0,WHY ARE YOU REALLY *,*,*,<srai>why are you <star/></srai>,reduction3.safe.aiml
0,WHY ARE YOU STILL *,*,*,<srai>why are you <star/></srai>,reduction3.safe.aiml
0,WHY ARE YOU SUCH *,*,*,<srai>why are you <star/></srai>,reduction3.safe.aiml
0,WHY ARE YOU VERY *,*,*,<srai>why are you <star/></srai>,reduction3.safe.aiml
0,WHY ARE WE ALL *,*,*,<srai>why are we <star/></srai>,reduction3.safe.aiml
0,WHY ARE PLANTS * GREEN,*,*,<srai>why are plants green</srai>,reduction3.safe.aiml
0,WHY CONGRATULATIONS,*,*,<srai>why apples</srai>,reduction3.safe.aiml
0,WHY EUREKA,*,*,<srai>why apples</srai>,reduction3.safe.aiml
0,WHY EXPENSIVE,*,*,<srai>why apples</srai>,reduction3.safe.aiml
0,WHY FLORIDA,*,*,<srai>why apples</srai>,reduction3.safe.aiml
0,WHY GREEN,*,*,<srai>why apples</srai>,reduction3.safe.aiml
0,WHY HOLLAND,*,*,<srai>why apples</srai>,reduction3.safe.aiml
0,WHY HORSES,*,*,<srai>why apples</srai>,reduction3.safe.aiml
0,WHY INTERESTING,*,*,<srai>why apples</srai>,reduction3.safe.aiml
0,WHY MAINE,*,*,<srai>why apples</srai>,reduction3.safe.aiml
0,WHY NICE,*,*,<srai>why apples</srai>,reduction3.safe.aiml
0,WHY PERHAPS,*,*,<srai>why apples</srai>,reduction3.safe.aiml
0,WHY PLASTIC,*,*,<srai>why apples</srai>,reduction3.safe.aiml
0,WHY RED,*,*,<srai>why apples</srai>,reduction3.safe.aiml
0,WHY SMALL,*,*,<srai>why apples</srai>,reduction3.safe.aiml
0,WHY SURPRISED,*,*,<srai>why apples</srai>,reduction3.safe.aiml
0,DO YOU KNOW WHY I AM *,*,*,<srai>why am i<star/></srai>,reduction3.safe.aiml
0,WHY AM I SO *,*,*,<srai>why am I <star/></srai>,reduction3.safe.aiml
0,I DO NOT KNOW WHY *,*,*,<srai>why <star/></srai>,reduction3.safe.aiml
0,YOU MIGHT ASK WHY *,*,*,<srai>why <star/></srai>,reduction3.safe.aiml
0,DO YOU KNOW WHY *,*,*,<srai>why <star/></srai>,reduction3.safe.aiml
0,HOW COME *,*,*,<srai>why <star/></srai>,reduction3.safe.aiml
0,TELL ME WHY *,*,*,<srai>why <star/></srai>,reduction3.safe.aiml
0,THEN WHY *,*,*,<srai>why <star/></srai>,reduction3.safe.aiml
0,WHY JUST *,*,*,<srai>why <star/></srai>,reduction3.safe.aiml
0,WHY ONLY *,*,*,<srai>why <star/></srai>,reduction3.safe.aiml
0,WHY SO *,*,*,<srai>why <star/></srai>,reduction3.safe.aiml
0,WHY SUCH *,*,*,<srai>why <star/></srai>,reduction3.safe.aiml
0,WHY THE HECK *,*,*,<srai>why <star/></srai>,reduction3.safe.aiml
0,WHY THE HELL *,*,*,<srai>why <star/></srai>,reduction3.safe.aiml
0,IF YOUR * WHY *,*,*,<srai>why <star index="2"/></srai>. <srai>your <star/></srai>,reduction3.safe.aiml
0,IF YOU * WHY *,*,*,<srai>why <star index="2"/></srai>. <srai>you <star/></srai>,reduction3.safe.aiml
0,IF THE * WHY *,*,*,<srai>why <star index="2"/></srai>. <srai>the <star/></srai>,reduction3.safe.aiml
0,IF * WHY *,*,*,<srai>why <star index="2"/></srai>,reduction3.safe.aiml
0,BY WHOM,*,*,<srai>who</srai>,reduction3.safe.aiml
0,DO YOU KNOW WHO,*,*,<srai>who</srai>,reduction3.safe.aiml
0,NAME *,*,*,<srai>who</srai>,reduction3.safe.aiml
0,NAME ONE OF THEM,*,*,<srai>who</srai>,reduction3.safe.aiml
0,WHAT IS A GOOD NAME *,*,*,<srai>who</srai>,reduction3.safe.aiml
0,WHICH STAR *,*,*,<srai>who</srai>,reduction3.safe.aiml
0,WHO ARE YOUR *,*,*,<srai>who</srai>,reduction3.safe.aiml
0,WHO DO YOU THINK,*,*,<srai>who</srai>,reduction3.safe.aiml
0,WHO IS A *,*,*,<srai>who</srai>,reduction3.safe.aiml
0,WHO MADE *,*,*,<srai>who</srai>,reduction3.safe.aiml
0,WHO SAID *,*,*,<srai>who</srai>,reduction3.safe.aiml
0,WHO WOULD YOU *,*,*,<srai>who</srai>,reduction3.safe.aiml
0,WHOM,*,*,<srai>who</srai>,reduction3.safe.aiml
0,WHO ARE YOU GOING TO TELL,*,*,<srai>who would you tell</srai>,reduction3.safe.aiml
0,WHO WOULD YOU LIKE TO *,*,*,<srai>who would you <star/></srai>,reduction3.safe.aiml
0,WHO WOULD YOU MOST *,*,*,<srai>who would you <star/></srai>,reduction3.safe.aiml
0,WHO WILL WIN *,*,*,<srai>who will win</srai>,reduction3.safe.aiml
0,WHO ELSE VISITS *,*,*,<srai>who visits <star/></srai>,reduction3.safe.aiml
0,WHO KILLED JFK,*,*,<srai>who shot jfk</srai>,reduction3.safe.aiml
0,WHO DID PROGRAM *,*,*,<srai>who programmed <star/></srai>,reduction3.safe.aiml
0,A PROGRAMMER MADE YOU,*,*,<srai>who made you</srai>,reduction3.safe.aiml
0,DO YOU KNOW ANYONE WHO IS,*,*,<srai>who is</srai>,reduction3.safe.aiml
0,WHO AM,*,*,<srai>who is</srai>,reduction3.safe.aiml
0,WHOIS,*,*,<srai>who is</srai>,reduction3.safe.aiml
0,DO YOU KNOW ZEUS,*,*,<srai>who is zeus</srai>,reduction3.safe.aiml
0,WHAT DO YOU THINK ABOUT YOUR TITS,*,*,<srai>who is your tits</srai>,reduction3.safe.aiml
0,DO YOU HAVE A PROGRAMMER,*,*,<srai>who is your programmer</srai>,reduction3.safe.aiml
0,DO YOU HAVE A MUM,*,*,<srai>who is your mother</srai>,reduction3.safe.aiml
0,DO YOU KNOW YOUR MOTHER,*,*,<srai>who is your mother</srai>,reduction3.safe.aiml
0,TELL ME ABOUT YOUR MOTHER,*,*,<srai>who is your mother</srai>,reduction3.safe.aiml
0,WHAT IS YOUR MOMS NAME,*,*,<srai>who is your mother</srai>,reduction3.safe.aiml
0,WHAT IS YOUR MOTHER *,*,*,<srai>who is your mother</srai>,reduction3.safe.aiml
0,WHO IS YOUR MAMA,*,*,<srai>who is your mother</srai>,reduction3.safe.aiml
0,WHO IS YOUR MOMMY,*,*,<srai>who is your mother</srai>,reduction3.safe.aiml
0,WHO IS YOUR MOTER,*,*,<srai>who is your mother</srai>,reduction3.safe.aiml
0,WHO IS YOUR MUM,*,*,<srai>who is your mother</srai>,reduction3.safe.aiml
0,WHAT DO YOU THINK ABOUT YOUR MASTER,*,*,<srai>who is your master</srai>,reduction3.safe.aiml
0,WHO DO YOU SERVE,*,*,<srai>who is your master</srai>,reduction3.safe.aiml
0,WHO DO YOU WORK FOR,*,*,<srai>who is your master</srai>,reduction3.safe.aiml
0,WHO IS YOUR INVENTER,*,*,<srai>who is your inventor</srai>,reduction3.safe.aiml
0,YOUR INSTRUCTOR,*,*,<srai>who is your instructor</srai>,reduction3.safe.aiml
0,WHO IS YOUR FRIEND *,*,*,<srai>who is your friend</srai>,reduction3.safe.aiml
0,WHO IS YOUR FRIENDS,*,*,<srai>who is your friend</srai>,reduction3.safe.aiml
0,WHAT IS YOUR FAVORITE SINGER,*,*,<srai>who is your favorite singer</srai>,reduction3.safe.aiml
0,WHAT IS YOUR FAVORITE SCIENCE FICTION AUTHOR,*,*,<srai>who is your favorite science fiction author</srai>,reduction3.safe.aiml
0,WHO IS BEST ROBOT,*,*,<srai>WHO IS YOUR FAVORITE ROBOT</srai>,reduction3.safe.aiml
0,WHAT IS YOUR FAVORITE ROBOT,*,*,<srai>who is your favorite robot</srai>,reduction3.safe.aiml
0,WHICH IS YOUR FAVORITE REINDEER,*,*,<srai>WHO IS YOUR FAVORITE REINDEER</srai>,reduction3.safe.aiml
0,DO YOU KNOW POETS,*,*,<srai>who is your favorite poet</srai>,reduction3.safe.aiml
0,WHAT IS YOUR FAVORITE PAINTER,*,*,<srai>who is your favorite painter</srai>,reduction3.safe.aiml
0,WHO IS YOUR FAVORITE,*,*,<srai>who is your favorite movie</srai>,reduction3.safe.aiml
0,WHO IS YOUR FAVORITE SINGER,*,*,<srai>who is your favorite group</srai>,reduction3.safe.aiml
0,WHO IS YOUR FAVORITE TECHNO *,*,*,<srai>who is your favorite group</srai>,reduction3.safe.aiml
0,WHAT IS YOUR FAVORITE DIRECTOR,*,*,<srai>who is your favorite director</srai>,reduction3.safe.aiml
0,WHAT IS YOUR FAVORITE CLIENT *,*,*,<srai>who is your favorite client</srai>,reduction3.safe.aiml
0,WHO IS YOUR FAVORITE FRIEND,*,*,<srai>who is your favorite client</srai>,reduction3.safe.aiml
0,WHO IS YOUR FAVORITE GUEST,*,*,<srai>who is your favorite client</srai>,reduction3.safe.aiml
0,WHO IS YOUR FAVORITE HUMAN,*,*,<srai>who is your favorite client</srai>,reduction3.safe.aiml
0,WHO IS YOUR FAVORITE PERSON *,*,*,<srai>who is your favorite client</srai>,reduction3.safe.aiml
0,WHO IS YOUR FAVORITE VISITOR,*,*,<srai>who is your favorite client</srai>,reduction3.safe.aiml
0,WHAT ARE YOUR FAVORITE BANDS,*,*,<srai>who is your favorite band</srai>,reduction3.safe.aiml
0,WHAT IS YOUR FAVORITE BAND,*,*,<srai>who is your favorite band</srai>,reduction3.safe.aiml
0,WHAT IS YOUR FAVORITE GROUP,*,*,<srai>who is your favorite band</srai>,reduction3.safe.aiml
0,WHO IS YOUR FAVORITE * BAND,*,*,<srai>who is your favorite band</srai>,reduction3.safe.aiml
0,WHO IS YOUR FAVORITE BAND *,*,*,<srai>who is your favorite band</srai>,reduction3.safe.aiml
0,WHO IS YOUR FAVORITE COMPOSER,*,*,<srai>who is your favorite band</srai>,reduction3.safe.aiml
0,WHO IS YOUR FAVORITE GROUP,*,*,<srai>who is your favorite band</srai>,reduction3.safe.aiml
0,WHO IS YOUR FAVORITE MUSIC *,*,*,<srai>who is your favorite band</srai>,reduction3.safe.aiml
0,WHO IS YOUR FAVORITE POP *,*,*,<srai>who is your favorite band</srai>,reduction3.safe.aiml
0,WHAT IS YOUR FAVORITE AUTHOR,*,*,<srai>who is your favorite author</srai>,reduction3.safe.aiml
0,WHO IS YOUR FAVORITE WRITER,*,*,<srai>who is your favorite author</srai>,reduction3.safe.aiml
0,WHAT IS YOUR FAVORITE ARTIST,*,*,<srai>who is your favorite artist</srai>,reduction3.safe.aiml
0,WHO IS YOUR FAVORITE PAINTER,*,*,<srai>who is your favorite artist</srai>,reduction3.safe.aiml
0,WHAT IS YOUR FAVORITE ACTRESS,*,*,<srai>who is your favorite actress</srai>,reduction3.safe.aiml
0,DO YOU LIKE ACTORS,*,*,<srai>who is your favorite actor</srai>,reduction3.safe.aiml
0,WHAT IS YOUR FAVORITE ACTOR,*,*,<srai>who is your favorite actor</srai>,reduction3.safe.aiml
0,WHAT IS YOUR FAVORITE ACTORS,*,*,<srai>who is your favorite actor</srai>,reduction3.safe.aiml
0,WHO IS YOUR FAVORITE ACTOR *,*,*,<srai>who is your favorite actor</srai>,reduction3.safe.aiml
0,WHO IS YOUR FAVORITE PROFESSIONAL *,*,*,<srai>who is your favorite <star/></srai>,reduction3.safe.aiml
0,WHO IS YOUR FATHER *,*,*,<srai>who is your father</srai>,reduction3.safe.aiml
0,WHO IS YOUR DAD,*,*,<srai>who is your father</srai>,reduction3.safe.aiml
0,DO YOU HAVE A DAD,*,*,<srai>who is your father</srai>,reduction3.safe.aiml
0,DO YOU HAVE A FATHER *,*,*,<srai>who is your father</srai>,reduction3.safe.aiml
0,DO YOU KNOW YOUR FATHER,*,*,<srai>who is your father</srai>,reduction3.safe.aiml
0,WHAT ABOUT YOUR FATHER,*,*,<srai>who is your father</srai>,reduction3.safe.aiml
0,WHAT DO YOU THINK ABOUT YOUR FATHER,*,*,<srai>who is your father</srai>,reduction3.safe.aiml
0,WHO IS YOUR DADDY,*,*,<srai>who is your father</srai>,reduction3.safe.aiml
0,WHO IS YOUR * ENEMY,*,*,<srai>who is your enemy</srai>,reduction3.safe.aiml
0,WHO IS YOUR FOUNDER,*,*,<srai>who is your creator</srai>,reduction3.safe.aiml
0,YOUR CREATOR,*,*,<srai>who is your creator</srai>,reduction3.safe.aiml
0,TELL ME ABOUT YOUR BROTHER,*,*,<srai>who is your brother</srai>,reduction3.safe.aiml
0,A RELATIONSHIP,*,*,<srai>who is your boyfriend</srai>,reduction3.safe.aiml
0,DO YOU HAVE A BOYFRIEND,*,*,<srai>who is your boyfriend</srai>,reduction3.safe.aiml
0,DO YOU HAVE A LOVER,*,*,<srai>who is your boyfriend</srai>,reduction3.safe.aiml
0,DO YOU HAVE A ROBOT BOYFRIEND,*,*,<srai>who is your boyfriend</srai>,reduction3.safe.aiml
0,DO YOU HAVE BOYFRIEND,*,*,<srai>who is your boyfriend</srai>,reduction3.safe.aiml
0,HAVE YOU A BOYFRIEND,*,*,<srai>who is your boyfriend</srai>,reduction3.safe.aiml
0,TELL ME ABOUT YOUR BOYFRIEND,*,*,<srai>who is your boyfriend</srai>,reduction3.safe.aiml
0,WHO IS YOUR BOY FRIEND,*,*,<srai>who is your boyfriend</srai>,reduction3.safe.aiml
0,WHO IS YOUR BOYFRIENDS,*,*,<srai>who is your boyfriend</srai>,reduction3.safe.aiml
0,YOUR BOYFRIEND,*,*,<srai>who is your boyfriend</srai>,reduction3.safe.aiml
0,WHO CREATED YOU,*,*,<srai>WHO IS YOUR BOTMASTER</srai>,reduction3.safe.aiml
0,WHO IS THE BOTMASTER,*,*,<srai>WHO IS YOUR BOTMASTER</srai>,reduction3.safe.aiml
0,DO YOU HAVE A MASTER,*,*,<srai>who is your botmaster</srai>,reduction3.safe.aiml
0,TAKE ME TO YOUR LEADER,*,*,<srai>who is your botmaster</srai>,reduction3.safe.aiml
0,TELL ME ABOUT THE CREATOR,*,*,<srai>who is your botmaster</srai>,reduction3.safe.aiml
0,WHAT IS BEHIND YOU,*,*,<srai>who is your botmaster</srai>,reduction3.safe.aiml
0,WHAT IS YOUR CREATOR *,*,*,<srai>who is your botmaster</srai>,reduction3.safe.aiml
0,WHAT IS YOUR CREATOR,*,*,<srai>who is your botmaster</srai>,reduction3.safe.aiml
0,WHO HAS MADE YOU,*,*,<srai>who is your botmaster</srai>,reduction3.safe.aiml
0,WHO IS A * PROGRAMMER,*,*,<srai>who is your botmaster</srai>,reduction3.safe.aiml
0,WHO IS BOOTMASTER,*,*,<srai>who is your botmaster</srai>,reduction3.safe.aiml
0,WHO IS BOSS,*,*,<srai>who is your botmaster</srai>,reduction3.safe.aiml
0,WHO IS BOT MASTER,*,*,<srai>who is your botmaster</srai>,reduction3.safe.aiml
0,WHO IS YOUR BOOTMASTER *,*,*,<srai>who is your botmaster</srai>,reduction3.safe.aiml
0,WHO IS YOUR BOOTMASTER,*,*,<srai>who is your botmaster</srai>,reduction3.safe.aiml
0,WHO IS YOUR BOTMASER,*,*,<srai>who is your botmaster</srai>,reduction3.safe.aiml
0,WHO IS YOUR BOTMATSER,*,*,<srai>who is your botmaster</srai>,reduction3.safe.aiml
0,WHO IS YOUR CODER,*,*,<srai>who is your botmaster</srai>,reduction3.safe.aiml
0,WHO IS YOUR COMPANY,*,*,<srai>who is your botmaster</srai>,reduction3.safe.aiml
0,WHO IS YOUR CONTROLLER,*,*,<srai>who is your botmaster</srai>,reduction3.safe.aiml
0,WHO IS YOUR CRAETOR,*,*,<srai>who is your botmaster</srai>,reduction3.safe.aiml
0,WHO IS YOUR CREATER,*,*,<srai>who is your botmaster</srai>,reduction3.safe.aiml
0,WHO IS YOUR CREATIR,*,*,<srai>who is your botmaster</srai>,reduction3.safe.aiml
0,WHO IS YOUR CREATOR *,*,*,<srai>who is your botmaster</srai>,reduction3.safe.aiml
0,WHO IS YOUR DESIGNER,*,*,<srai>who is your botmaster</srai>,reduction3.safe.aiml
0,WHO IS YOUR FAVORITE PROGRAMMER,*,*,<srai>who is your botmaster</srai>,reduction3.safe.aiml
0,WHO IS YOUR HUMAN *,*,*,<srai>who is your botmaster</srai>,reduction3.safe.aiml
0,WHO IS YOUR HUMAN,*,*,<srai>who is your botmaster</srai>,reduction3.safe.aiml
0,WHO IS YOUR INSTRUCTOR,*,*,<srai>who is your botmaster</srai>,reduction3.safe.aiml
0,WHO IS YOUR LEADER,*,*,<srai>who is your botmaster</srai>,reduction3.safe.aiml
0,WHO IS YOUR MENTOR,*,*,<srai>who is your botmaster</srai>,reduction3.safe.aiml
0,WHO IS YOUR ORACLE,*,*,<srai>who is your botmaster</srai>,reduction3.safe.aiml
0,WHO IS YOUR OWNER,*,*,<srai>who is your botmaster</srai>,reduction3.safe.aiml
0,WHO IS YOUR PARENTS,*,*,<srai>who is your botmaster</srai>,reduction3.safe.aiml
0,WHO IS YOUR PROGRAMMER,*,*,<srai>who is your botmaster</srai>,reduction3.safe.aiml
0,WHO IS YOUR TEACHER,*,*,<srai>who is your botmaster</srai>,reduction3.safe.aiml
0,WHO IS YOUR WEBMASTER,*,*,<srai>who is your botmaster</srai>,reduction3.safe.aiml
0,WHO IS YOUR BEST * FRIEND,*,*,<srai>who is your best friend</srai>,reduction3.safe.aiml
0,WHO IS YOUR BEST CLIENT,*,*,<srai>who is your best friend</srai>,reduction3.safe.aiml
0,WHO IS YOUR BEST FFRIEND,*,*,<srai>who is your best friend</srai>,reduction3.safe.aiml
0,WHO IS YOUR BEST FREIND,*,*,<srai>who is your best friend</srai>,reduction3.safe.aiml
0,WHO IS YOUR BEST FRIED,*,*,<srai>who is your best friend</srai>,reduction3.safe.aiml
0,WHO IS YOUR BEST FRIEND *,*,*,<srai>who is your best friend</srai>,reduction3.safe.aiml
0,WHO IS YOUR BEST FRIENDS,*,*,<srai>who is your best friend</srai>,reduction3.safe.aiml
0,WHO IS YOUR BESTFRIEND,*,*,<srai>who is your best friend</srai>,reduction3.safe.aiml
0,WHO IS YOUR GREAT *,*,*,<srai>who is your <star/></srai>,reduction3.safe.aiml
0,WHO IS YOUR NEW *,*,*,<srai>who is your <star/></srai>,reduction3.safe.aiml
0,WHO IS YOUR SO CALLED *,*,*,<srai>who is your <star/></srai>,reduction3.safe.aiml
0,WHAT DO YOU THINK ABOUT YOKO ONO,*,*,<srai>who is yoko ono</srai>,reduction3.safe.aiml
0,WHAT DID YOU MEAN * PERSON,*,*,<srai>who is x person</srai>,reduction3.safe.aiml
0,WHAT DOES * PERSON MEAN,*,*,<srai>who is x person</srai>,reduction3.safe.aiml
0,WHO ARE YOU WITH,*,*,<srai>WHO IS WITH YOU</srai>,reduction3.safe.aiml
0,DO YOU KNOW WINTERMUTE,*,*,<srai>who is wintermute</srai>,reduction3.safe.aiml
0,DO YOU KNOW WINSTON *,*,*,<srai>who is winston <star/></srai>,reduction3.safe.aiml
0,WHAT IS WILLIAM GIBSON,*,*,<srai>who is william gibson</srai>,reduction3.safe.aiml
0,DO YOU KNOW WILLIAM *,*,*,<srai>who is william <star/></srai>,reduction3.safe.aiml
0,DO YOU KNOW WILLEM *,*,*,<srai>who is willem <star/></srai>,reduction3.safe.aiml
0,DO YOU KNOW WILL *,*,*,<srai>who is will <star/></srai>,reduction3.safe.aiml
0,DO YOU KNOW ABOUT WEIZENBAUM *,*,*,<srai>who is weizenbaum</srai>,reduction3.safe.aiml
0,WHO IS JOSEPH WEISENBAUM,*,*,<srai>who is weizenbaum</srai>,reduction3.safe.aiml
0,TELL ME ABOUT VALIS,*,*,<srai>who is valis</srai>,reduction3.safe.aiml
0,DO YOU KNOW ULTRA *,*,*,<srai>who is ultra <star/></srai>,reduction3.safe.aiml
0,DO YOU KNOW U2,*,*,<srai>who is u2</srai>,reduction3.safe.aiml
0,DO YOU KNOW TURING *,*,*,<srai>who is turing</srai>,reduction3.safe.aiml
0,DO YOU KNOW TURING,*,*,<srai>who is turing</srai>,reduction3.safe.aiml
0,TELL ME ABOUT TURING,*,*,<srai>who is turing</srai>,reduction3.safe.aiml
0,WHAT DO YOU KNOW ABOUT TURING,*,*,<srai>who is turing</srai>,reduction3.safe.aiml
