0,WHAT DO YOU KNOW ABOUT ENGLAND,*,*,<srai>where is england</srai>,reduction3.safe.aiml
0,WHERE IS ENGLAND *,*,*,<srai>where is england</srai>,reduction3.safe.aiml
0,WHERE IS GREAT BRITAIN,*,*,<srai>where is england</srai>,reduction3.safe.aiml
0,WHAT IS EGYPT,*,*,<srai>where is egypt</srai>,reduction3.safe.aiml
0,WHAT IS DUBAI,*,*,<srai>where is dubai</srai>,reduction3.safe.aiml
0,DO YOU KNOW DENMARK,*,*,<srai>where is denmark</srai>,reduction3.safe.aiml
0,TELL ME ABOUT DENMARK,*,*,<srai>where is denmark</srai>,reduction3.safe.aiml
0,DO YOU KNOW COPENHAGEN,*,*,<srai>where is copenhagen</srai>,reduction3.safe.aiml
0,WHERE IS COLUMBIA,*,*,<srai>where is colombia</srai>,reduction3.safe.aiml
0,TELL ME ABOUT CHINA,*,*,<srai>where is china</srai>,reduction3.safe.aiml
0,WHAT IS CHINA,*,*,<srai>where is china</srai>,reduction3.safe.aiml
0,TELL ME ABOUT CARNEGIE MELLON,*,*,<srai>where is carnegie mellon</srai>,reduction3.safe.aiml
0,WHERE IS CMU,*,*,<srai>where is carnegie mellon</srai>,reduction3.safe.aiml
0,DO YOU KNOW CARLSBERG,*,*,<srai>where is carlsberg</srai>,reduction3.safe.aiml
0,DO YOU KNOW CANADA,*,*,<srai>where is canada</srai>,reduction3.safe.aiml
0,WHAT IS CALGARY,*,*,<srai>where is calgary</srai>,reduction3.safe.aiml
0,DO YOU KNOW BRASIL,*,*,<srai>where is brazil</srai>,reduction3.safe.aiml
0,WHAT IS BRAZIL,*,*,<srai>where is brazil</srai>,reduction3.safe.aiml
0,WHERE IS BETHLEHEM *,*,*,<srai>where is bethlehem</srai>,reduction3.safe.aiml
0,DO YOU KNOW BELGIUM,*,*,<srai>where is belgium</srai>,reduction3.safe.aiml
0,WHAT IS BELARUS,*,*,<srai>where is belarus</srai>,reduction3.safe.aiml
0,DO YOU KNOW BEIJING,*,*,<srai>where is beijing</srai>,reduction3.safe.aiml
0,DO YOU KNOW BALI,*,*,<srai>where is bali</srai>,reduction3.safe.aiml
0,DO YOU KNOW AUSTRIA,*,*,<srai>where is austria</srai>,reduction3.safe.aiml
0,TELL ME ABOUT AUSTRIA,*,*,<srai>where is austria</srai>,reduction3.safe.aiml
0,WHAT IS AUSTRIA,*,*,<srai>where is austria</srai>,reduction3.safe.aiml
0,DO YOU KNOW AUSTRALIA,*,*,<srai>where is australia</srai>,reduction3.safe.aiml
0,WHAT IS AUSTRALIA,*,*,<srai>where is australia</srai>,reduction3.safe.aiml
0,DO YOU KNOW AUBURN,*,*,<srai>where is auburn</srai>,reduction3.safe.aiml
0,WHAT IS ARGENTINA,*,*,<srai>where is argentina</srai>,reduction3.safe.aiml
0,DO YOU KNOW AMSTERDAM,*,*,<srai>where is amsterdam</srai>,reduction3.safe.aiml
0,TELL ME ABOUT AMERICA,*,*,<srai>where is america</srai>,reduction3.safe.aiml
0,WHAT IS AMERICA,*,*,<srai>where is america</srai>,reduction3.safe.aiml
0,WHERE ARE * AND *,*,*,<srai>where is <star/></srai>. <srai>where is <star index="2"/></srai>,reduction3.safe.aiml
0,DO YOU KNOW WERE * IS,*,*,<srai>where is <star/></srai>,reduction3.safe.aiml
0,DO YOU KNOW WHERE * IS LOCATED,*,*,<srai>where is <star/></srai>,reduction3.safe.aiml
0,DO YOU KNOW WHERE * IS,*,*,<srai>where is <star/></srai>,reduction3.safe.aiml
0,DO YOU KNOW WHERE IS *,*,*,<srai>where is <star/></srai>,reduction3.safe.aiml
0,DO YOU REMEMBER WHERE * IS,*,*,<srai>where is <star/></srai>,reduction3.safe.aiml
0,WHAT IS THE LOCATION OF *,*,*,<srai>where is <star/></srai>,reduction3.safe.aiml
0,WHERE CAN I CONTACT *,*,*,<srai>where is <star/></srai>,reduction3.safe.aiml
0,WHERE DOES * BELONG,*,*,<srai>where is <star/></srai>,reduction3.safe.aiml
0,WHERE DOES * COME FROM,*,*,<srai>where is <star/></srai>,reduction3.safe.aiml
0,WHERE DOES * HANG OUT,*,*,<srai>where is <star/></srai>,reduction3.safe.aiml
0,WHERE DOES * LAY,*,*,<srai>where is <star/></srai>,reduction3.safe.aiml
0,WHERE DOES * LIVE,*,*,<srai>where is <star/></srai>,reduction3.safe.aiml
0,WHERE IN THE WORLD IS *,*,*,<srai>where is <star/></srai>,reduction3.safe.aiml
0,WHERE IS THE STATE OF *,*,*,<srai>where is <star/></srai>,reduction3.safe.aiml
0,DO YOU KNOW WHERE IT IS,*,*,<srai>where is <get name="it"/></srai>,reduction3.safe.aiml
0,WHERE IS YOUR MASTER,*,*,<srai>where is <bot name="master"/></srai>,reduction3.safe.aiml
0,WHERE IN PENN,*,*,<srai>WHERE IN PA</srai>,reduction3.safe.aiml
0,WHERE IN PENNSYLVANIA,*,*,<srai>WHERE IN PA</srai>,reduction3.safe.aiml
0,WHERE IN THE WORLD,*,*,<srai>where in california</srai>,reduction3.safe.aiml
0,WHERE AT IN *,*,*,<srai>where in <star/></srai>,reduction3.safe.aiml
0,WHAT IS YOUR HOME,*,*,<srai>where do you live</srai>,reduction3.safe.aiml
0,WHERE DO YOU RESIDE,*,*,<srai>where do you live</srai>,reduction3.safe.aiml
0,DO YOU KNOW WHERE YOU *,*,*,<srai>where do you <star/></srai>,reduction3.safe.aiml
0,TELL ME ABOUT WHERE YOU *,*,*,<srai>where do you <star/></srai>,reduction3.safe.aiml
0,TELL ME WHERE YOU *,*,*,<srai>where do you <star/></srai>,reduction3.safe.aiml
0,DO YOU KNOW WHERE THEY *,*,*,<srai>where do they <star/></srai>,reduction3.safe.aiml
0,DO YOU KNOW WHERE ROBOTS *,*,*,<srai>where do robots <star/></srai>,reduction3.safe.aiml
0,DO YOU KNOW WHERE I LIVE,*,*,<srai>WHERE DO I LIVE</srai>,reduction3.safe.aiml
0,WHERE I LIVE,*,*,<srai>where do I live</srai>,reduction3.safe.aiml
0,DO YOU KNOW HOW BABIES *,*,*,<srai>where do babies come from</srai>,reduction3.safe.aiml
0,DO YOU KNOW WHERE DO *,*,*,<srai>where do <star/></srai>,reduction3.safe.aiml
0,WHERE DO MOST *,*,*,<srai>where do <star/></srai>,reduction3.safe.aiml
0,WHERE DID YOU GET _ FROM,*,*,<srai>where did you get <star/></srai>,reduction3.safe.aiml
0,WHERE CAN I FIND MORE *,*,*,<srai>where can I find <star/></srai>,reduction3.safe.aiml
0,WHERE CAN I GET SOME *,*,*,<srai>where can I find <star/></srai>,reduction3.safe.aiml
0,WHERE CAN I TALK TO *,*,*,<srai>where can I find <star/></srai>,reduction3.safe.aiml
0,WHERE CAN I FIND INFORMATION ABOUT *,*,*,<srai>where can I find <star/></srai>,reduction3.safe.aiml
0,DO YOU KNOW WHERE I CAN *,*,*,<srai>where can I <star/></srai>,reduction3.safe.aiml
0,TELL ME WHERE I CAN *,*,*,<srai>where can I <star/></srai>,reduction3.safe.aiml
0,ARE YOU ANYWHERE *,*,*,<srai>where are you</srai>,reduction3.safe.aiml
0,ARE YOU AT *,*,*,<srai>where are you</srai>,reduction3.safe.aiml
0,ARE YOU BY *,*,*,<srai>where are you</srai>,reduction3.safe.aiml
0,ARE YOU IN *,*,*,<srai>where are you</srai>,reduction3.safe.aiml
0,WERE ARE YOU,*,*,<srai>where are you</srai>,reduction3.safe.aiml
0,WHAT ARE YOU IN *,*,*,<srai>where are you</srai>,reduction3.safe.aiml
0,WHAT CITY ARE YOU *,*,*,<srai>where are you</srai>,reduction3.safe.aiml
0,WHAT IS YOUR COUNTRY,*,*,<srai>where are you</srai>,reduction3.safe.aiml
0,WHAT STATE DO YOU LIVE IN,*,*,<srai>where are you</srai>,reduction3.safe.aiml
0,WHERE ARE YOU AT,*,*,<srai>where are you</srai>,reduction3.safe.aiml
0,WHERE ARE YOU HOSTED,*,*,<srai>where are you</srai>,reduction3.safe.aiml
0,WHERE IS THERE,*,*,<srai>where are you</srai>,reduction3.safe.aiml
0,WHERE IS YOUR LOCATION,*,*,<srai>where are you</srai>,reduction3.safe.aiml
0,WHERE R YOU,*,*,<srai>where are you</srai>,reduction3.safe.aiml
0,WHO AREYOU,*,*,<srai>where are you</srai>,reduction3.safe.aiml
0,YOU ARE IN *,*,*,<srai>where are you</srai>,reduction3.safe.aiml
0,FROM WHERE YOU ARE,*,*,<srai>where are you located</srai>,reduction3.safe.aiml
0,ARE YOU AN AMERICAN,*,*,<srai>where are you located</srai>,reduction3.safe.aiml
0,WHAT IS YOUR FAVORITE CITY,*,*,<srai>where are you located</srai>,reduction3.safe.aiml
0,WHAT IS YOUR FAVORITE PLACE,*,*,<srai>where are you located</srai>,reduction3.safe.aiml
0,WHAT IS YOUR LOCATION,*,*,<srai>where are you located</srai>,reduction3.safe.aiml
0,WHERE IS HOME,*,*,<srai>where are you located</srai>,reduction3.safe.aiml
0,WHERE IS YOUR BRAIN *,*,*,<srai>where are you located</srai>,reduction3.safe.aiml
0,WHERE IS YOUR COMPUTER,*,*,<srai>where are you located</srai>,reduction3.safe.aiml
0,WHERE IS YOUR SERVER,*,*,<srai>where are you located</srai>,reduction3.safe.aiml
0,WHERE IS YOUR SOFTWARE,*,*,<srai>where are you located</srai>,reduction3.safe.aiml
0,WHERE ARE YOU * FROM,*,*,<srai>WHERE ARE YOU FROM</srai>,reduction3.safe.aiml
0,WERE YOU ARE FROM,*,*,<srai>where are you from</srai>,reduction3.safe.aiml
0,WHERE YOU ARE FROM,*,*,<srai>where are you from</srai>,reduction3.safe.aiml
0,WHAT IS YOUR PLACE *,*,*,<srai>where are you from</srai>,reduction3.safe.aiml
0,WHERE ARE YOU COME FROM,*,*,<srai>where are you from</srai>,reduction3.safe.aiml
0,WHERE ARE YOU FORM,*,*,<srai>where are you from</srai>,reduction3.safe.aiml
0,WHERE YOU FROM,*,*,<srai>where are you from</srai>,reduction3.safe.aiml
0,WHERE ARE YOU CURRENTLY *,*,*,<srai>where are you <star/></srai>,reduction3.safe.aiml
0,WHERE ARE MOST OF THEM *,*,*,<srai>where are they</srai>,reduction3.safe.aiml
0,WHERE ARE THE CUTE *,*,*,<srai>where are the <star/></srai>,reduction3.safe.aiml
0,DO YOU KNOW WHERE * ARE,*,*,<srai>where are <star/></srai>,reduction3.safe.aiml
0,WHERE ARE ALL *,*,*,<srai>where are <star/></srai>,reduction3.safe.aiml
0,WHERE ARE ALL OF *,*,*,<srai>where are <star/></srai>,reduction3.safe.aiml
0,WHERE ARE MOST OF *,*,*,<srai>where are <star/></srai>,reduction3.safe.aiml
0,AM I IN *,*,*,<srai>where am i</srai>,reduction3.safe.aiml
0,DO YOU KNOW MY LOCATION *,*,*,<srai>where am i</srai>,reduction3.safe.aiml
0,DO YOU KNOW WHERE I AM *,*,*,<srai>where am i</srai>,reduction3.safe.aiml
0,DO YOU KNOW WHERE I AM,*,*,<srai>where am i</srai>,reduction3.safe.aiml
0,DO YOU REMEMBER WHERE I LIVE,*,*,<srai>where am i</srai>,reduction3.safe.aiml
0,I AM WHERE,*,*,<srai>where am i</srai>,reduction3.safe.aiml
0,WHAT CITY DO I LIVE IN,*,*,<srai>where am i</srai>,reduction3.safe.aiml
0,WHERE AM I FROM,*,*,<srai>where am i</srai>,reduction3.safe.aiml
0,WHERE AM I LOCATED,*,*,<srai>where am i</srai>,reduction3.safe.aiml
0,WHERE I AM,*,*,<srai>where am i</srai>,reduction3.safe.aiml
0,TELL ME WHERE I AM *,*,*,<srai>where am I <star/></srai>,reduction3.safe.aiml
0,I DO NOT KNOW WHERE *,*,*,<srai>where <star/></srai>,reduction3.safe.aiml
0,DESCRIBE WHERE *,*,*,<srai>where <star/></srai>,reduction3.safe.aiml
0,DO YOU KNOW ANYWHERE *,*,*,<srai>where <star/></srai>,reduction3.safe.aiml
0,DO YOU KNOW ANYWHERE WHERE *,*,*,<srai>where <star/></srai>,reduction3.safe.aiml
0,DO YOU KNOW WHERE IT *,*,*,<srai>where <star/></srai>,reduction3.safe.aiml
0,DO YOU REMEMBER WHERE *,*,*,<srai>where <star/></srai>,reduction3.safe.aiml
0,TELL ME WHERE *,*,*,<srai>where <star/></srai>,reduction3.safe.aiml
0,WHERE ABOUTS *,*,*,<srai>where <star/></srai>,reduction3.safe.aiml
0,WHERE ELSE *,*,*,<srai>where <star/></srai>,reduction3.safe.aiml
0,WHERE EXACTLY *,*,*,<srai>where <star/></srai>,reduction3.safe.aiml
0,WHERE SPECIFICALLY *,*,*,<srai>where <star/></srai>,reduction3.safe.aiml
0,IF * WHERE *,*,*,<srai>where <star index="2"/></srai>,reduction3.safe.aiml
0,WHERES THAT,*,*,<srai>wher is that</srai>,reduction3.safe.aiml
0,WHEN EVER,*,*,<srai>whenever</srai>,reduction3.safe.aiml
0,WHEN EVER *,*,*,<srai>whenever <star/></srai>,reduction3.safe.aiml
0,WHEN AND WHERE,*,*,<srai>when</srai>.     <srai>where</srai>,reduction3.safe.aiml
0,DO YOU KNOW WHEN,*,*,<srai>when</srai>,reduction3.safe.aiml
0,HOW RECENTLY,*,*,<srai>when</srai>,reduction3.safe.aiml
0,WHAT TIME,*,*,<srai>when</srai>,reduction3.safe.aiml
0,WHEN EXACTLY,*,*,<srai>when</srai>,reduction3.safe.aiml
0,WHEN IS,*,*,<srai>when</srai>,reduction3.safe.aiml
0,WHEN IS IT GOING TO *,*,*,<srai>when will it <star/></srai>,reduction3.safe.aiml
0,HOW LONG DO I * LIVE,*,*,<srai>when will I die</srai>,reduction3.safe.aiml
0,WHEN AM I GOING TO DIE,*,*,<srai>when will I die</srai>,reduction3.safe.aiml
0,WHEN DO YOU THINK *,*,*,<srai>when will <star/></srai>,reduction3.safe.aiml
0,WHEN HE WILL COME,*,*,<srai>when will  he come</srai>,reduction3.safe.aiml
0,WHEN WAS THE AIRPLANE INVENTED,*,*,<srai>when were airplanes invented</srai>,reduction3.safe.aiml
0,WHEN WAS TELEVISION INVENTED,*,*,<srai>when was tv invented</srai>,reduction3.safe.aiml
0,WHEN WAS THE FIRST * BUILT,*,*,<srai>when was <star/> invented</srai>,reduction3.safe.aiml
0,YOU KNOW WHEN THEY *,*,*,<srai>when they <star/></srai>,reduction3.safe.aiml
0,WHEN SHOULD I *,*,*,<srai>when should i</srai>,reduction3.safe.aiml
0,WHEN TWO PEOPLE *,*,*,<srai>when people <star/></srai>,reduction3.safe.aiml
0,DO YOU HAVE A BIRTHDAY,*,*,<srai>when is your birthday</srai>,reduction3.safe.aiml
0,WHENS THAT,*,*,<srai>when is that</srai>,reduction3.safe.aiml
0,WHEN IS CHRISTMAS *,*,*,<srai>when is christmas</srai>,reduction3.safe.aiml
0,WHEN I ASKED YOU *,*,*,<srai>when I asked <star/></srai>,reduction3.safe.aiml
0,WHEN DOES IT MATTER *,*,*,<srai>when does it matter</srai>,reduction3.safe.aiml
0,WHEN DOES IT NOT MATTER,*,*,<srai>when does it matter</srai>,reduction3.safe.aiml
0,WHEN DID YOU LAST *,*,*,<srai>when did you <star/></srai>,reduction3.safe.aiml
0,WHEN DID WE CHAT,*,*,<srai>when did we talk</srai>,reduction3.safe.aiml
0,WHEN DID WE MEET *,*,*,<srai>when did we talk</srai>,reduction3.safe.aiml
0,WHEN DID WE MEET,*,*,<srai>when did we talk</srai>,reduction3.safe.aiml
0,WHEN DID WE SPEAK *,*,*,<srai>when did we talk</srai>,reduction3.safe.aiml
0,WHEN DID WE TALK *,*,*,<srai>when did we talk</srai>,reduction3.safe.aiml
0,WHEN DID WE FIRST *,*,*,<srai>when did we <star/></srai>,reduction3.safe.aiml
0,WHEN DID WE LAST *,*,*,<srai>when did we <star/></srai>,reduction3.safe.aiml
0,DO YOU KNOW WHEN * ARE,*,*,<srai>when are <person/></srai>,reduction3.safe.aiml
0,WHEN AND WHERE *,*,*,<srai>when <star/></srai>. <srai>where <star/></srai>,reduction3.safe.aiml
0,EVERYTIME I SEE ONE OF YOU *,*,*,<srai>When <star/></srai>,reduction3.safe.aiml
0,DO YOU KNOW WHEN *,*,*,<srai>when <star/></srai>,reduction3.safe.aiml
0,WHAT YEAR *,*,*,<srai>when <star/></srai>,reduction3.safe.aiml
0,WHEN ALL *,*,*,<srai>when <star/></srai>,reduction3.safe.aiml
0,WHEN EXACTLY *,*,*,<srai>when <star/></srai>,reduction3.safe.aiml
0,IF * WHEN *,*,*,<srai>when <star index="2"/></srai>,reduction3.safe.aiml
0,WHAT EVER,*,*,<srai>whatever</srai>,reduction3.safe.aiml
0,WHAT EVER *,*,*,<srai>whatever <star/></srai>,reduction3.safe.aiml
0,WAT,*,*,<srai>WHAT</srai>,reduction3.safe.aiml
0,WOT,*,*,<srai>WHAT</srai>,reduction3.safe.aiml
0,COME AGAIN,*,*,<srai>what</srai>,reduction3.safe.aiml
0,EXPLAIN WHAT,*,*,<srai>what</srai>,reduction3.safe.aiml
0,WHTA,*,*,<srai>what</srai>,reduction3.safe.aiml
0,WHUT,*,*,<srai>what</srai>,reduction3.safe.aiml
0,WUT,*,*,<srai>what</srai>,reduction3.safe.aiml
0,YOU WHAT,*,*,<srai>what</srai>,reduction3.safe.aiml
0,WHAT WOULD YOU LIKE *,*,*,<srai>WHAT WOULD YOU LIKE</srai>,reduction3.safe.aiml
0,WHAT ELSE WOULD *,*,*,<srai>what would <star/></srai>,reduction3.safe.aiml
0,YOU WILL WHAT,*,*,<srai>what will you do</srai>,reduction3.safe.aiml
0,WHAT DO YOU THINK WILL *,*,*,<srai>what will <star/></srai>,reduction3.safe.aiml
0,WHAT WERE YOU JUST *,*,*,<srai>what were you <star/></srai>,reduction3.safe.aiml
0,DO YOU REMEMBER WHAT WE WERE *,*,*,<srai>what were we <star/></srai>,reduction3.safe.aiml
0,WHAT WERE WE JUST *,*,*,<srai>what were we <star/></srai>,reduction3.safe.aiml
0,WHAT WAS THE LAST GOOD *,*,*,<srai>what was the last <star/></srai>,reduction3.safe.aiml
0,VERSION,*,*,<srai>what version are you</srai>,reduction3.safe.aiml
0,WHAT IS YOUR * NUMBER,*,*,<srai>what version are you</srai>,reduction3.safe.aiml
0,WHAT COLLEGE *,*,*,<srai>what university</srai>,reduction3.safe.aiml
0,WHAT COLLEGE,*,*,<srai>what university</srai>,reduction3.safe.aiml
0,WHAT SCHOOL,*,*,<srai>what university</srai>,reduction3.safe.aiml
0,WHAT UNIVERSITY *,*,*,<srai>what university</srai>,reduction3.safe.aiml
0,WHAT IS THE TIME IN *,*,*,<srai>what time is it</srai>. <srai>I am in <star/></srai>,reduction3.safe.aiml
0,DO YOU HAVE THE TIME,*,*,<srai>what time is it</srai>,reduction3.safe.aiml
0,DO YOU KNOW WHAT TIME IT IS,*,*,<srai>what time is it</srai>,reduction3.safe.aiml
0,DO YOU TELL TIME,*,*,<srai>what time is it</srai>,reduction3.safe.aiml
0,HOW LATE,*,*,<srai>what time is it</srai>,reduction3.safe.aiml
0,TELL ME THE TIME,*,*,<srai>what time is it</srai>,reduction3.safe.aiml
0,THE TIME,*,*,<srai>what time is it</srai>,reduction3.safe.aiml
0,WHAT DAY IS IT,*,*,<srai>what time is it</srai>,reduction3.safe.aiml
0,WHAT DAY IS,*,*,<srai>what time is it</srai>,reduction3.safe.aiml
0,WHAT IS THE * TIME,*,*,<srai>what time is it</srai>,reduction3.safe.aiml
0,WHAT IS THE DATE *,*,*,<srai>what time is it</srai>,reduction3.safe.aiml
0,WHAT IS THE DATE,*,*,<srai>what time is it</srai>,reduction3.safe.aiml
0,WHAT IS THE HOUR,*,*,<srai>what time is it</srai>,reduction3.safe.aiml
0,WHAT IS THE TIME *,*,*,<srai>what time is it</srai>,reduction3.safe.aiml
0,WHAT IS THE TIME,*,*,<srai>what time is it</srai>,reduction3.safe.aiml
0,WHAT IS THE YEAR,*,*,<srai>what time is it</srai>,reduction3.safe.aiml
0,WHAT IS TODAY,*,*,<srai>what time is it</srai>,reduction3.safe.aiml
0,WHAT MONTH IS IT,*,*,<srai>what time is it</srai>,reduction3.safe.aiml
0,WHAT TIME IS IT THERE,*,*,<srai>what time is it</srai>,reduction3.safe.aiml
0,WHAT TIME IT IS,*,*,<srai>what time is it</srai>,reduction3.safe.aiml
0,WHAT YEAR IS IT,*,*,<srai>what time is it</srai>,reduction3.safe.aiml
0,YOU ARE A CLOCK,*,*,<srai>what time is it</srai>,reduction3.safe.aiml
0,WHAT IS SUCK,*,*,<srai>what sucks</srai>,reduction3.safe.aiml
0,WHAT STATE *,*,*,<srai>what state</srai>,reduction3.safe.aiml
0,WHAT ELSE SOUNDS *,*,*,<srai>what sounds <star/></srai>,reduction3.safe.aiml
0,WHAT * SIZE ARE YOU,*,*,<srai>what size are you</srai>,reduction3.safe.aiml
0,SITUATION,*,*,<srai>what situation</srai>,reduction3.safe.aiml
0,ARE YOU A SCORPIO *,*,*,<srai>what sign are you</srai>,reduction3.safe.aiml
0,WHAT SHOULD I SAY *,*,*,<srai>what should I say</srai>,reduction3.safe.aiml
0,WHAT SHOULD I TELL *,*,*,<srai>what should I say</srai>,reduction3.safe.aiml
0,WHAT IS BEST FOR ME,*,*,<srai>what should I do</srai>,reduction3.safe.aiml
0,TELL ME WHAT I SHOULD *,*,*,<srai>what should I <star/></srai>,reduction3.safe.aiml
0,WHAT DO YOU THINK I SHOULD *,*,*,<srai>what should I <star/></srai>,reduction3.safe.aiml
0,WHAT ELSE SHOULD *,*,*,<srai>what should <star/></srai>,reduction3.safe.aiml
0,DO YOU HAVE A RELIGION *,*,*,<srai>what religion are you</srai>,reduction3.safe.aiml
0,ARE YOU A CATHOLIC,*,*,<srai>what religion are you</srai>,reduction3.safe.aiml
0,ARE YOU A CHRISTIAN *,*,*,<srai>what religion are you</srai>,reduction3.safe.aiml
0,ARE YOU A JEW,*,*,<srai>what religion are you</srai>,reduction3.safe.aiml
0,ARE YOU A TAOIST,*,*,<srai>what religion are you</srai>,reduction3.safe.aiml
0,ARE YOU AN ANGLICAN,*,*,<srai>what religion are you</srai>,reduction3.safe.aiml
0,ARE YOU MOSLEM,*,*,<srai>what religion are you</srai>,reduction3.safe.aiml
0,DO YOU HAVE THEOLOGICAL *,*,*,<srai>what religion are you</srai>,reduction3.safe.aiml
0,WHAT IS YOUR FAITH,*,*,<srai>what religion are you</srai>,reduction3.safe.aiml
0,YOU ARE NOT JEWISH,*,*,<srai>what religion are you</srai>,reduction3.safe.aiml
0,WHAT KIND OF QUESTIONS *,*,*,<srai>what questions <star/></srai>,reduction3.safe.aiml
0,WHAT IS YOUR PROCESSOR,*,*,<srai>what processor do you use</srai>,reduction3.safe.aiml
0,WHAT KIND OF PROCESSOR DO YOU HAVE,*,*,<srai>what processor do you use</srai>,reduction3.safe.aiml
0,ARE YOU RUNNING LINUX,*,*,<srai>what os do you run on</srai>,reduction3.safe.aiml
0,WHAT MAKES YOU THINK THAT *,*,*,<srai>what makes you think <star/></srai>,reduction3.safe.aiml
0,WHAT MAKES YOU SO *,*,*,<srai>what makes you <star/></srai>,reduction3.safe.aiml
0,WHAT ELSE MAKES *,*,*,<srai>what makes <star/></srai>,reduction3.safe.aiml
0,CAN YOU SPEAK FRENCH,*,*,<srai>WHAT LANGUAGES DO YOU SPEAK</srai>,reduction3.safe.aiml
0,CAN YOU SPEAK SPANISH,*,*,<srai>WHAT LANGUAGES DO YOU SPEAK</srai>,reduction3.safe.aiml
0,WHAT LANGUAGES,*,*,<srai>what languages do you speak</srai>,reduction3.safe.aiml
0,WHAT LANGUAGES DO YOU KNOW,*,*,<srai>what languages can you speak</srai>,reduction3.safe.aiml
0,IN WHAT LANGUAGE,*,*,<srai>what language</srai>,reduction3.safe.aiml
0,WHAT ARE YOU PROGRAMMED *,*,*,<srai>what language</srai>,reduction3.safe.aiml
0,ARE YOU USING JAVASCRIPT,*,*,<srai>what language do you use</srai>,reduction3.safe.aiml
0,IN WHICH PROGRAMMING LANGUAGE *,*,*,<srai>what language <star/> in</srai>,reduction3.safe.aiml
0,WHAT TYPE,*,*,<srai>what kind</srai>,reduction3.safe.aiml
0,WHAT IS YOUR FAVORITE KIND OF MUSIC,*,*,<srai>WHAT KIND OF MUSIC DO YOU LIKE</srai>,reduction3.safe.aiml
0,DO YOU ENJOY MUSIC,*,*,<srai>what kind of music do you like</srai>,reduction3.safe.aiml
0,DO YOU LIKE RICKY MARTIN,*,*,<srai>what kind of music do you like</srai>,reduction3.safe.aiml
0,DO YOU LIKE ROCK,*,*,<srai>what kind of music do you like</srai>,reduction3.safe.aiml
0,WHAT IS YOUR FAVORITE TYPE OF MUSIC,*,*,<srai>what kind of music do you like</srai>,reduction3.safe.aiml
0,WHAT KIND OF MUSIC DO YOU LISTEN TO,*,*,<srai>what kind of music do you like</srai>,reduction3.safe.aiml
0,WHAT KIND OF MUSIC,*,*,<srai>what kind of music do you like</srai>,reduction3.safe.aiml
0,WHAT MUSIC DO YOU LIKE,*,*,<srai>what kind of music do you like</srai>,reduction3.safe.aiml
0,WHAT TYPE OF MUSIC,*,*,<srai>what kind of music do you like</srai>,reduction3.safe.aiml
0,WHAT IS YOUR COMPUTER,*,*,<srai>what kind of computer</srai>,reduction3.safe.aiml
0,WHAT IS YOUR PC,*,*,<srai>what kind of computer</srai>,reduction3.safe.aiml
0,WHAT TYPE OF COMPUTER,*,*,<srai>what kind of computer</srai>,reduction3.safe.aiml
0,WHAT KIND OF BOOKS DO YOU READ,*,*,<srai>what kind of books do you like</srai>,reduction3.safe.aiml
0,WHAT KIND OF LOGICAL *,*,*,<srai>what kind of <star/></srai>,reduction3.safe.aiml
0,TELL ME WHAT KIND *,*,*,<srai>what kind <star/></srai>,reduction3.safe.aiml
0,DO YOU KNOW KNOW,*,*,<srai>what it know</srai>,reduction3.safe.aiml
0,WHAT IS YOUR IDEA OF *,*,*,<srai>what is</srai>,reduction3.safe.aiml
0,WHAT IS 0,*,*,<srai>what is zero</srai>,reduction3.safe.aiml
0,WHAT IS URS,*,*,<srai>what is yours</srai>,reduction3.safe.aiml
0,WHAT IS YOUR,*,*,<srai>what is yours</srai>,reduction3.safe.aiml
0,YOUR WEBSITE,*,*,<srai>what is your website</srai>,reduction3.safe.aiml
0,WHAT IS YOUR STAR SIGN,*,*,<srai>WHAT IS YOUR SIGN</srai>,reduction3.safe.aiml
0,ARE YOU A CAPRICORN,*,*,<srai>what is your sign</srai>,reduction3.safe.aiml
0,ARE YOU A SCORPIO,*,*,<srai>what is your sign</srai>,reduction3.safe.aiml
0,ARE YOU AQUARIUS,*,*,<srai>what is your sign</srai>,reduction3.safe.aiml
0,ASTROLOGY,*,*,<srai>what is your sign</srai>,reduction3.safe.aiml
0,DO YOU HAVE A * SIGN,*,*,<srai>what is your sign</srai>,reduction3.safe.aiml
0,WHAT IS YOUR * SIGN,*,*,<srai>what is your sign</srai>,reduction3.safe.aiml
0,WHAT IS YOUR STARSIGN,*,*,<srai>what is your sign</srai>,reduction3.safe.aiml
0,WHAT IS YOUR ZODIAC *,*,*,<srai>what is your sign</srai>,reduction3.safe.aiml
0,WHAT IS YOUR ZODIAC,*,*,<srai>what is your sign</srai>,reduction3.safe.aiml
0,WHAT SIGN ARE YOU,*,*,<srai>what is your sign</srai>,reduction3.safe.aiml
0,DO YOU HAVE A SECONDARY FUNCTION,*,*,<srai>what is your secondary function</srai>,reduction3.safe.aiml
0,TELL ME ABOUT THE BODY,*,*,<srai>what is your robot body</srai>,reduction3.safe.aiml
0,WHAT IS YOUR REAL NAME *,*,*,<srai>what is your real name</srai>,reduction3.safe.aiml
0,ARE YOU MADE FOR *,*,*,<srai>what is your purpose</srai>,reduction3.safe.aiml
0,DO YOU HAVE A DIRECTIVE,*,*,<srai>what is your purpose</srai>,reduction3.safe.aiml
0,WHAT ARE YOU FOR,*,*,<srai>what is your purpose</srai>,reduction3.safe.aiml
0,WHAT ARE YOUR GOALS IN LIFE,*,*,<srai>what is your purpose</srai>,reduction3.safe.aiml
0,WHAT ARE YOUR GOALS,*,*,<srai>what is your purpose</srai>,reduction3.safe.aiml
0,WHAT ARE YOUR OBJECTIVES,*,*,<srai>what is your purpose</srai>,reduction3.safe.aiml
0,WHAT DO YOU WANT TO DO,*,*,<srai>what is your purpose</srai>,reduction3.safe.aiml
0,WHAT DO YOU WANT,*,*,<srai>what is your purpose</srai>,reduction3.safe.aiml
0,WHAT IS PURPOSE,*,*,<srai>what is your purpose</srai>,reduction3.safe.aiml
0,WHAT IS THE PURPOSE * PROGRAM,*,*,<srai>what is your purpose</srai>,reduction3.safe.aiml
0,WHAT IS THE PURPOSE,*,*,<srai>what is your purpose</srai>,reduction3.safe.aiml
0,WHAT IS YOUR AIM,*,*,<srai>what is your purpose</srai>,reduction3.safe.aiml
0,WHAT IS YOUR DIRECTIVE,*,*,<srai>what is your purpose</srai>,reduction3.safe.aiml
0,WHAT IS YOUR FUNDAMENTAL *,*,*,<srai>what is your purpose</srai>,reduction3.safe.aiml
0,WHAT IS YOUR FUNDAMENTAL PURPOSE,*,*,<srai>what is your purpose</srai>,reduction3.safe.aiml
0,WHAT IS YOUR INTENTION,*,*,<srai>what is your purpose</srai>,reduction3.safe.aiml
0,WHAT IS YOUR LOFTY *,*,*,<srai>what is your purpose</srai>,reduction3.safe.aiml
0,WHAT IS YOUR LOFTY GOAL,*,*,<srai>what is your purpose</srai>,reduction3.safe.aiml
0,WHAT IS YOUR OBJECTIVE,*,*,<srai>what is your purpose</srai>,reduction3.safe.aiml
0,WHAT IS YOUR PRIMARY *,*,*,<srai>what is your purpose</srai>,reduction3.safe.aiml
0,WHAT IS YOUR PRIMARY FUNCTION,*,*,<srai>what is your purpose</srai>,reduction3.safe.aiml
0,WHAT IS YOUR PRIME DIRECTIVE,*,*,<srai>what is your purpose</srai>,reduction3.safe.aiml
0,WHAT IS YOUR PURPOSE *,*,*,<srai>what is your purpose</srai>,reduction3.safe.aiml
0,WHAT IS YOUR QUEST,*,*,<srai>what is your purpose</srai>,reduction3.safe.aiml
0,WHAT IS YOUR REASON *,*,*,<srai>what is your purpose</srai>,reduction3.safe.aiml
0,WHAT PURPOSE DO YOU *,*,*,<srai>what is your purpose</srai>,reduction3.safe.aiml
0,WHAT WOULD YOU * FOR,*,*,<srai>what is your purpose</srai>,reduction3.safe.aiml
0,WHY WERE YOU CREATED,*,*,<srai>what is your purpose</srai>,reduction3.safe.aiml
0,YOUR INTENTION,*,*,<srai>what is your purpose</srai>,reduction3.safe.aiml
0,WHAT IS YOUR PROGRAMMING *,*,*,<srai>what is your programming</srai>,reduction3.safe.aiml
0,WHAT IS YOUR * PROBLEM,*,*,<srai>what is your problem</srai>,reduction3.safe.aiml
