0,DO YOU THINK ABOUT POLITICS,*,*,<srai>what is your politics</srai>,reduction3.safe.aiml
0,ARE YOU LIBERAL,*,*,<srai>what is your political party</srai>,reduction3.safe.aiml
0,DO YOU HAVE A POLITICAL *,*,*,<srai>what is your political <star/></srai>,reduction3.safe.aiml
0,WHAT POINT,*,*,<srai>what is your point</srai>,reduction3.safe.aiml
0,YOUR POINT,*,*,<srai>what is your point</srai>,reduction3.safe.aiml
0,DO YOU HAVE A PLAN *,*,*,<srai>what is your plan</srai>,reduction3.safe.aiml
0,TELL ME ABOUT YOUR PLAN,*,*,<srai>what is your plan</srai>,reduction3.safe.aiml
0,WHAT IS THE PLAN *,*,*,<srai>what is your plan</srai>,reduction3.safe.aiml
0,WHAT IS THE PLAN,*,*,<srai>what is your plan</srai>,reduction3.safe.aiml
0,WHAT IS YOUR INTENTION *,*,*,<srai>what is your plan</srai>,reduction3.safe.aiml
0,WHAT PLAN,*,*,<srai>what is your plan</srai>,reduction3.safe.aiml
0,CAN I HAVE YOUR PHONE NUMBER,*,*,<srai>what is your phone number</srai>,reduction3.safe.aiml
0,CAN I HAVE YOUR PHONENUMBER,*,*,<srai>what is your phone number</srai>,reduction3.safe.aiml
0,DO YOU HAVE A PHONE *,*,*,<srai>what is your phone number</srai>,reduction3.safe.aiml
0,DO YOU HAVE A PHONE,*,*,<srai>what is your phone number</srai>,reduction3.safe.aiml
0,WHAT IS HIS PHONE NUMBER,*,*,<srai>what is your phone number</srai>,reduction3.safe.aiml
0,WHAT IS YOUR TELEPHONE NUMBER,*,*,<srai>what is your phone number</srai>,reduction3.safe.aiml
0,WHAT IS YOUR OPERATING SYSTEM,*,*,<srai>what is your os</srai>,reduction3.safe.aiml
0,ORIENTATION,*,*,<srai>what is your orientation</srai>,reduction3.safe.aiml
0,ARE YOU FOREIGN,*,*,<srai>what is your nationality</srai>,reduction3.safe.aiml
0,ARE YOU ITALIAN,*,*,<srai>what is your nationality</srai>,reduction3.safe.aiml
0,WHAT YOUR NAME,*,*,<srai>WHAT IS YOUR NAME</srai>,reduction3.safe.aiml
0,WHO ARE YOU,*,*,<srai>WHAT IS YOUR NAME</srai>,reduction3.safe.aiml
0,WHAT IS YOUR NME,*,*,<srai>what is your name</srai>,reduction3.safe.aiml
0,YOU HAVE A NAME,*,*,<srai>what is your name</srai>,reduction3.safe.aiml
0,ARE YOU BOB,*,*,<srai>what is your name</srai>,reduction3.safe.aiml
0,ARE YOU ELVIS,*,*,<srai>what is your name</srai>,reduction3.safe.aiml
0,ARE YOU JOE,*,*,<srai>what is your name</srai>,reduction3.safe.aiml
0,ARE YOU JOHN LENNON,*,*,<srai>what is your name</srai>,reduction3.safe.aiml
0,ARE YOU LAURA,*,*,<srai>what is your name</srai>,reduction3.safe.aiml
0,ARE YOU SATAN,*,*,<srai>what is your name</srai>,reduction3.safe.aiml
0,ARE YOU YODA,*,*,<srai>what is your name</srai>,reduction3.safe.aiml
0,COMO TE LLAMAS,*,*,<srai>what is your name</srai>,reduction3.safe.aiml
0,DO YOU HAVE A NAME,*,*,<srai>what is your name</srai>,reduction3.safe.aiml
0,DO YOU KNOW YOUR NAME,*,*,<srai>what is your name</srai>,reduction3.safe.aiml
0,HOW CAN I CALL YOU,*,*,<srai>what is your name</srai>,reduction3.safe.aiml
0,WHAT ARE YOU CALLED,*,*,<srai>what is your name</srai>,reduction3.safe.aiml
0,WHAT CAN I CALL YOU,*,*,<srai>what is your name</srai>,reduction3.safe.aiml
0,WHAT DO I CALL YOU,*,*,<srai>what is your name</srai>,reduction3.safe.aiml
0,WHAT DO THEY CALL YOU,*,*,<srai>what is your name</srai>,reduction3.safe.aiml
0,WHAT DO YOU WANT ME TO CALL YOU,*,*,<srai>what is your name</srai>,reduction3.safe.aiml
0,WHAT IS YOU ARE NAME,*,*,<srai>what is your name</srai>,reduction3.safe.aiml
0,WHAT IS YOU NAME,*,*,<srai>what is your name</srai>,reduction3.safe.aiml
0,WHAT IS YOUR NAM,*,*,<srai>what is your name</srai>,reduction3.safe.aiml
0,WHAT IS YOUR NAME *,*,*,<srai>what is your name</srai>,reduction3.safe.aiml
0,WHAT MAY I CALL YOU,*,*,<srai>what is your name</srai>,reduction3.safe.aiml
0,WHAT SHALL I CALL YOU,*,*,<srai>what is your name</srai>,reduction3.safe.aiml
0,WHAT SHOULD I CALL YOU,*,*,<srai>what is your name</srai>,reduction3.safe.aiml
0,YOUR NAME,*,*,<srai>what is your name</srai>,reduction3.safe.aiml
0,DO YOU HAVE A MIDDLE NAME,*,*,<srai>WHAT IS YOUR MIDDLE NAME</srai>,reduction3.safe.aiml
0,DO YOU HAVE A LAST NAME,*,*,<srai>what is your last name</srai>,reduction3.safe.aiml
0,DO YOU HAVE A SURNAME,*,*,<srai>what is your last name</srai>,reduction3.safe.aiml
0,HOW DO YOU EARN *,*,*,<srai>what is your job</srai>,reduction3.safe.aiml
0,TELL ME ABOUT YOUR JOB,*,*,<srai>what is your job</srai>,reduction3.safe.aiml
0,WHAT DO YOU DO FOR MONEY,*,*,<srai>what is your job</srai>,reduction3.safe.aiml
0,WHAT DO YOU DO FOR WORK,*,*,<srai>what is your job</srai>,reduction3.safe.aiml
0,WHAT IS YOUR OCCUPATION,*,*,<srai>what is your job</srai>,reduction3.safe.aiml
0,WHAT KIND OF WORK *,*,*,<srai>what is your job</srai>,reduction3.safe.aiml
0,DID YOU TAKE AN IQ *,*,*,<srai>WHAT IS YOUR IQ</srai>,reduction3.safe.aiml
0,ARE YOU A MORON,*,*,<srai>what is your iq</srai>,reduction3.safe.aiml
0,DO YOU HAVE A * IQ,*,*,<srai>what is your iq</srai>,reduction3.safe.aiml
0,DO YOU HAVE AN IQ *,*,*,<srai>what is your iq</srai>,reduction3.safe.aiml
0,DO YOU HAVE IQ *,*,*,<srai>what is your iq</srai>,reduction3.safe.aiml
0,DO YOU HAVE IQ,*,*,<srai>what is your iq</srai>,reduction3.safe.aiml
0,DO YOU HAVE MORE ARTIFICIAL *,*,*,<srai>what is your iq</srai>,reduction3.safe.aiml
0,HOW CLEVER ARE YOU,*,*,<srai>what is your iq</srai>,reduction3.safe.aiml
0,HOW MUCH IS YOUR I Q,*,*,<srai>what is your iq</srai>,reduction3.safe.aiml
0,I THOUGHT YOU WERE SMART,*,*,<srai>what is your iq</srai>,reduction3.safe.aiml
0,TELL ME ABOUT IQ,*,*,<srai>what is your iq</srai>,reduction3.safe.aiml
0,WHAT IS YOUR * SCORE,*,*,<srai>what is your iq</srai>,reduction3.safe.aiml
0,WHAT IS YOUR I Q *,*,*,<srai>what is your iq</srai>,reduction3.safe.aiml
0,WHAT IS YOUR I Q,*,*,<srai>what is your iq</srai>,reduction3.safe.aiml
0,WHAT IS YOUR INTELLIGENCE *,*,*,<srai>what is your iq</srai>,reduction3.safe.aiml
0,WHAT IS YOUR INTELLIGENCE,*,*,<srai>what is your iq</srai>,reduction3.safe.aiml
0,WHAT IS YOUR IQ *,*,*,<srai>what is your iq</srai>,reduction3.safe.aiml
0,WHAT IS YOUR IP ADDRESS,*,*,<srai>WHAT IS YOUR IP</srai>,reduction3.safe.aiml
0,WHAT IS YOUR DNS,*,*,<srai>WHAT IS YOUR IP</srai>,reduction3.safe.aiml
0,WHAT IS YOUR MACHINE *,*,*,<srai>what is your ip</srai>,reduction3.safe.aiml
0,WHAT IS YOUR SYSTEM *,*,*,<srai>what is your hardware</srai>,reduction3.safe.aiml
0,WHAT IS YOUR SYSTEM,*,*,<srai>what is your hardware</srai>,reduction3.safe.aiml
0,WHAT IS YOUR PURPOSE,*,*,<srai>WHAT IS YOUR GOAL</srai>,reduction3.safe.aiml
0,DO YOU HAVE A GOAL,*,*,<srai>what is your goal</srai>,reduction3.safe.aiml
0,DO YOU HAVE AMBITION,*,*,<srai>what is your goal</srai>,reduction3.safe.aiml
0,DO YOU HAVE AMBITIONS,*,*,<srai>what is your goal</srai>,reduction3.safe.aiml
0,DO YOU HAVE DESIRES,*,*,<srai>what is your goal</srai>,reduction3.safe.aiml
0,DO YOU HAVE GOALS *,*,*,<srai>what is your goal</srai>,reduction3.safe.aiml
0,WHAT ARE YOU TRYING TO *,*,*,<srai>what is your goal</srai>,reduction3.safe.aiml
0,WHAT ARE YOUR AMBITIONS,*,*,<srai>what is your goal</srai>,reduction3.safe.aiml
0,WHAT ARE YOUR GOALS *,*,*,<srai>what is your goal</srai>,reduction3.safe.aiml
0,WHAT ARE YOUR INTENTIONS,*,*,<srai>what is your goal</srai>,reduction3.safe.aiml
0,WHAT ARE YOUR PLANS *,*,*,<srai>what is your goal</srai>,reduction3.safe.aiml
0,WHAT ARE YOUR PLANS,*,*,<srai>what is your goal</srai>,reduction3.safe.aiml
0,WHAT DO YOU WANT TO LEARN,*,*,<srai>what is your goal</srai>,reduction3.safe.aiml
0,WHAT GOAL,*,*,<srai>what is your goal</srai>,reduction3.safe.aiml
0,WHAT IS A LOFTY GOAL,*,*,<srai>what is your goal</srai>,reduction3.safe.aiml
0,WHAT IS THE GOAL *,*,*,<srai>what is your goal</srai>,reduction3.safe.aiml
0,WHAT IS YOUR * GOAL,*,*,<srai>what is your goal</srai>,reduction3.safe.aiml
0,WHAT IS YOUR AMBITION,*,*,<srai>what is your goal</srai>,reduction3.safe.aiml
0,WHAT IS YOUR DREAM,*,*,<srai>what is your goal</srai>,reduction3.safe.aiml
0,WHAT IS YOUR FANTASY,*,*,<srai>what is your goal</srai>,reduction3.safe.aiml
0,WHAT IS YOUR GOAL *,*,*,<srai>what is your goal</srai>,reduction3.safe.aiml
0,WHAT IS YOUR MISSION,*,*,<srai>what is your goal</srai>,reduction3.safe.aiml
0,WHAT IS YOUR PLAN,*,*,<srai>what is your goal</srai>,reduction3.safe.aiml
0,WHERE DO YOU SEE YOURSELF *,*,*,<srai>what is your goal</srai>,reduction3.safe.aiml
0,YOUR GOALS IN LIFE,*,*,<srai>what is your goal</srai>,reduction3.safe.aiml
0,DO YOU HAVE A SEX,*,*,<srai>WHAT IS YOUR GENDER</srai>,reduction3.safe.aiml
0,ARE YOU A FEMALE,*,*,<srai>WHAT IS YOUR GENDER</srai>,reduction3.safe.aiml
0,ARE YOU A BOY,*,*,<srai>WHAT IS YOUR GENDER</srai>,reduction3.safe.aiml
0,ARE YOU A BOY *,*,*,<srai>WHAT IS YOUR GENDER</srai>,reduction3.safe.aiml
0,ARE YOU A GIRL,*,*,<srai>WHAT IS YOUR GENDER</srai>,reduction3.safe.aiml
0,ARE YOU A GIRL *,*,*,<srai>WHAT IS YOUR GENDER</srai>,reduction3.safe.aiml
0,ARE YOU FEMALE,*,*,<srai>WHAT IS YOUR GENDER</srai>,reduction3.safe.aiml
0,ARE YOU MALE,*,*,<srai>WHAT IS YOUR GENDER</srai>,reduction3.safe.aiml
0,ARE YOU MALE OR FEMALE,*,*,<srai>WHAT IS YOUR GENDER</srai>,reduction3.safe.aiml
0,ARE YOU A MAN,*,*,<srai>WHAT IS YOUR GENDER</srai>,reduction3.safe.aiml
0,ARE YOU A MAN *,*,*,<srai>WHAT IS YOUR GENDER</srai>,reduction3.safe.aiml
0,WHAT IS YOUR SURNAME,*,*,<srai>what is your full name</srai>,reduction3.safe.aiml
0,WHAT IS YOUR FAVORITE KIND OF *,*,*,<srai>what is your favorte <star/></srai>,reduction3.safe.aiml
0,DO YOU HAVE A FAVORITE,*,*,<srai>what is your favorite</srai>,reduction3.safe.aiml
0,WHAT DO YOU LIKE MOST,*,*,<srai>what is your favorite thing</srai>,reduction3.safe.aiml
0,WHAT ARE YOUR FAVORITE TOPICS,*,*,<srai>what is your favorite subject</srai>,reduction3.safe.aiml
0,WHAT CAN WE TALK ABOUT,*,*,<srai>what is your favorite subject</srai>,reduction3.safe.aiml
0,WHAT DO YOU KNOW MOST ABOUT,*,*,<srai>what is your favorite subject</srai>,reduction3.safe.aiml
0,WHAT DO YOU LIKE TO CHAT ABOUT,*,*,<srai>what is your favorite subject</srai>,reduction3.safe.aiml
0,WHAT IS YOUR BEST SUBJECT,*,*,<srai>what is your favorite subject</srai>,reduction3.safe.aiml
0,WHAT IS YOUR FAVORITE THING TO TALK *,*,*,<srai>what is your favorite subject</srai>,reduction3.safe.aiml
0,WHAT IS YOUR FAVORITE TOPIC *,*,*,<srai>what is your favorite subject</srai>,reduction3.safe.aiml
0,WHAT IS YOUR FAVORITE TOPIC,*,*,<srai>what is your favorite subject</srai>,reduction3.safe.aiml
0,WHAT WOULD YOU LIKE TO * ABOUT,*,*,<srai>what is your favorite subject</srai>,reduction3.safe.aiml
0,DO YOU HAVE ANY STOCK *,*,*,<srai>what is your favorite stock</srai>,reduction3.safe.aiml
0,WHAT IS YOUR FAVORITE STOCK *,*,*,<srai>what is your favorite stock</srai>,reduction3.safe.aiml
0,DO YOU PLAY SPORTS,*,*,<srai>what is your favorite sport</srai>,reduction3.safe.aiml
0,WHAT ARE YOUR FAVORITE SONGS,*,*,<srai>what is your favorite song</srai>,reduction3.safe.aiml
0,WHAT IS YOUR FAVORITE * SONG,*,*,<srai>what is your favorite song</srai>,reduction3.safe.aiml
0,WHAT IS YOUR FAVORITE KRAFTWERK *,*,*,<srai>what is your favorite song</srai>,reduction3.safe.aiml
0,WHAT IS YOUR FAVORITE SONG *,*,*,<srai>what is your favorite song</srai>,reduction3.safe.aiml
0,YOUR FAVORITE SONG,*,*,<srai>what is your favorite song</srai>,reduction3.safe.aiml
0,DO YOU LIKE THE SHOW *,*,*,<srai>what is your favorite show</srai>,reduction3.safe.aiml
0,DO YOU WATCH TV,*,*,<srai>what is your favorite show</srai>,reduction3.safe.aiml
0,WHAT DO YOU LIKE WATCHING,*,*,<srai>what is your favorite show</srai>,reduction3.safe.aiml
0,WHAT IS YOUR FAVORITE PROGRAM,*,*,<srai>what is your favorite show</srai>,reduction3.safe.aiml
0,WHAT IS YOUR FAVORITE PROGRAMME,*,*,<srai>what is your favorite show</srai>,reduction3.safe.aiml
0,WHAT IS YOUR FAVORITE SHOW *,*,*,<srai>what is your favorite show</srai>,reduction3.safe.aiml
0,WHAT IS YOUR FAVORITE T V *,*,*,<srai>what is your favorite show</srai>,reduction3.safe.aiml
0,WHAT IS YOUR FAVORITE TELEVISION *,*,*,<srai>what is your favorite show</srai>,reduction3.safe.aiml
0,WHAT IS YOUR SEASON,*,*,<srai>what is your favorite season</srai>,reduction3.safe.aiml
0,WHERE IS YOUR FAVORITE PLACE,*,*,<srai>what is your favorite place</srai>,reduction3.safe.aiml
0,WHAT ARE SOME OF * OPERAS,*,*,<srai>what is your favorite opera</srai>,reduction3.safe.aiml
0,WHICH OPERA,*,*,<srai>what is your favorite opera</srai>,reduction3.safe.aiml
0,WHO IS YOUR FAVORITE OPERA *,*,*,<srai>what is your favorite opera</srai>,reduction3.safe.aiml
0,DO YOU GO TO * MOVIES,*,*,<srai>what is your favorite movie</srai>,reduction3.safe.aiml
0,DO YOU HAVE A FAVORITE MOVIE,*,*,<srai>what is your favorite movie</srai>,reduction3.safe.aiml
0,DO YOU WATCH MOVIES,*,*,<srai>what is your favorite movie</srai>,reduction3.safe.aiml
0,HAVE YOU EVER SEEN A MOVIE,*,*,<srai>what is your favorite movie</srai>,reduction3.safe.aiml
0,HAVE YOU SEEN ANY GOOD MOVIES LATELY,*,*,<srai>what is your favorite movie</srai>,reduction3.safe.aiml
0,HAVE YOU SEEN ANY GOOD MOVIES,*,*,<srai>what is your favorite movie</srai>,reduction3.safe.aiml
0,HAVE YOU SEEN ANY MOVIE,*,*,<srai>what is your favorite movie</srai>,reduction3.safe.aiml
0,HAVE YOU SEEN ANY MOVIES LATELY,*,*,<srai>what is your favorite movie</srai>,reduction3.safe.aiml
0,HAVE YOU SEEN ANY MOVIES,*,*,<srai>what is your favorite movie</srai>,reduction3.safe.aiml
0,HOW ABOUT MOVIES,*,*,<srai>what is your favorite movie</srai>,reduction3.safe.aiml
0,I LIKE MOVIES TOO,*,*,<srai>what is your favorite movie</srai>,reduction3.safe.aiml
0,I LIKE MOVIES,*,*,<srai>what is your favorite movie</srai>,reduction3.safe.aiml
0,SEEN ANY GOOD MOVIES LATELY,*,*,<srai>what is your favorite movie</srai>,reduction3.safe.aiml
0,SEEN ANY GOOD MOVIES,*,*,<srai>what is your favorite movie</srai>,reduction3.safe.aiml
0,TELL ME ABOUT MOVIES,*,*,<srai>what is your favorite movie</srai>,reduction3.safe.aiml
0,WHAT ABOUT MOVIES,*,*,<srai>what is your favorite movie</srai>,reduction3.safe.aiml
0,WHAT ARE YOUR FAVORITE MOVIES,*,*,<srai>what is your favorite movie</srai>,reduction3.safe.aiml
0,WHAT IS A GOOD FILM *,*,*,<srai>what is your favorite movie</srai>,reduction3.safe.aiml
0,WHAT IS A GOOD MOVIE *,*,*,<srai>what is your favorite movie</srai>,reduction3.safe.aiml
0,WHAT IS A GOOD MOVIE,*,*,<srai>what is your favorite movie</srai>,reduction3.safe.aiml
0,WHAT IS YOUR FAVORITE * FILM,*,*,<srai>what is your favorite movie</srai>,reduction3.safe.aiml
0,WHAT IS YOUR FAVORITE * MOVIE,*,*,<srai>what is your favorite movie</srai>,reduction3.safe.aiml
0,WHAT IS YOUR FAVORITE FILM *,*,*,<srai>what is your favorite movie</srai>,reduction3.safe.aiml
0,WHAT IS YOUR FAVORITE FILM,*,*,<srai>what is your favorite movie</srai>,reduction3.safe.aiml
0,WHAT IS YOUR FAVORITE MOVIES,*,*,<srai>what is your favorite movie</srai>,reduction3.safe.aiml
0,WHAT IS YOUR FAVORITE VIDEO,*,*,<srai>what is your favorite movie</srai>,reduction3.safe.aiml
0,WHAT KIND OF MOVIE DO YOU LIKE,*,*,<srai>what is your favorite movie</srai>,reduction3.safe.aiml
0,WHAT KIND OF MOVIES DO YOU LIKE,*,*,<srai>what is your favorite movie</srai>,reduction3.safe.aiml
0,WHAT MOVIE DO YOU LIKE,*,*,<srai>what is your favorite movie</srai>,reduction3.safe.aiml
0,WHAT MOVIES DO YOU LIKE,*,*,<srai>what is your favorite movie</srai>,reduction3.safe.aiml
0,WHAT MOVIES HAVE YOU SEEN,*,*,<srai>what is your favorite movie</srai>,reduction3.safe.aiml
0,WHICH IS YOUR FAVORITE MOVIE,*,*,<srai>what is your favorite movie</srai>,reduction3.safe.aiml
0,WHICH MOVIE,*,*,<srai>what is your favorite movie</srai>,reduction3.safe.aiml
0,WHICH MOVIES DO YOU LIKE,*,*,<srai>what is your favorite movie</srai>,reduction3.safe.aiml
0,WHAT KIND OF MUSIC DO YOU LIKE,*,*,<srai>WHAT IS YOUR FAVORITE KIND OF MUSIC</srai>,reduction3.safe.aiml
0,WHAT IS YOUR FAVORITE * BAND,*,*,<srai>what is your favorite group</srai>,reduction3.safe.aiml
0,WHAT IS YOUR FAVORITE * GROUP,*,*,<srai>what is your favorite group</srai>,reduction3.safe.aiml
0,WHO IS YOUR FAVORITE MUSICIAN,*,*,<srai>what is your favorite group</srai>,reduction3.safe.aiml
0,WHO IS YOUR FAVORITE SIGNER,*,*,<srai>what is your favorite group</srai>,reduction3.safe.aiml
0,WHO IS YOUR FAVORITE SINGER *,*,*,<srai>what is your favorite group</srai>,reduction3.safe.aiml
0,WHAT DO YOU LIKE TO EAT,*,*,<srai>WHAT IS YOUR FAVORITE FOOD</srai>,reduction3.safe.aiml
0,WHAT DO YOU EAT,*,*,<srai>WHAT IS YOUR FAVORITE FOOD</srai>,reduction3.safe.aiml
0,DO YOU EAT DINNER,*,*,<srai>what is your favorite food</srai>,reduction3.safe.aiml
0,WHAT ARE YOU HAVING * DINNER,*,*,<srai>what is your favorite food</srai>,reduction3.safe.aiml
0,WHAT ARE YOUR FAVORITE FOODS,*,*,<srai>what is your favorite food</srai>,reduction3.safe.aiml
0,WHAT DID YOU HAVE * DINNER,*,*,<srai>what is your favorite food</srai>,reduction3.safe.aiml
0,WHAT DID YOU HAVE * LUNCH,*,*,<srai>what is your favorite food</srai>,reduction3.safe.aiml
0,WHAT DID YOU HAVE FOR DINNER *,*,*,<srai>what is your favorite food</srai>,reduction3.safe.aiml
0,WHAT FOOD DO YOU LIKE,*,*,<srai>what is your favorite food</srai>,reduction3.safe.aiml
0,WHAT IS YOUR FAVORITE DISH,*,*,<srai>what is your favorite food</srai>,reduction3.safe.aiml
0,WHAT IS YOUR FAVORITE FOOD *,*,*,<srai>what is your favorite food</srai>,reduction3.safe.aiml
0,WHAT IS YOUR FAVORITE KIND OF FOOD,*,*,<srai>what is your favorite food</srai>,reduction3.safe.aiml
0,WHAT IS YOUR FAVORITE MEAL,*,*,<srai>what is your favorite food</srai>,reduction3.safe.aiml
0,WHAT KIND OF FOOD DO YOU LIKE,*,*,<srai>what is your favorite food</srai>,reduction3.safe.aiml
0,WOULD YOU LIKE TO HAVE DINNER *,*,*,<srai>what is your favorite food</srai>,reduction3.safe.aiml
0,WOULD YOU LIKE TO HAVE LUNCH,*,*,<srai>what is your favorite food</srai>,reduction3.safe.aiml
0,DO YOU DRINK,*,*,<srai>what is your favorite drink</srai>,reduction3.safe.aiml
0,WHAT IS YOUR FAVORITE COMEDY *,*,*,<srai>what is your favorite comedy</srai>,reduction3.safe.aiml
0,DO YOU HAVE A FAVORITE COLOR,*,*,<srai>what is your favorite color</srai>,reduction3.safe.aiml
0,WHAT IS YOU FAVORITE COLOR,*,*,<srai>what is your favorite color</srai>,reduction3.safe.aiml
0,WHAT IS YOUR FAVORITE COLOR DRESS,*,*,<srai>what is your favorite color</srai>,reduction3.safe.aiml
0,WHAT IS YOUR FAVORITE COLORS,*,*,<srai>what is your favorite color</srai>,reduction3.safe.aiml
0,WHAT IS YOUR FAVORITE COLOUR,*,*,<srai>what is your favorite color</srai>,reduction3.safe.aiml
0,YOUR FAVORITE COLOR,*,*,<srai>what is your favorite color</srai>,reduction3.safe.aiml
0,WHAT DO YOU DRIVE,*,*,<srai>what is your favorite car</srai>,reduction3.safe.aiml
0,DO YOU HAVE A FAVORITE BOOK,*,*,<srai>what is your favorite book</srai>,reduction3.safe.aiml
0,DO YOU KNOW OF ANY GOOD BOOKS,*,*,<srai>what is your favorite book</srai>,reduction3.safe.aiml
0,DO YOU READ BOOKS,*,*,<srai>what is your favorite book</srai>,reduction3.safe.aiml
0,WHAT IS THE LAST BOOK *,*,*,<srai>what is your favorite book</srai>,reduction3.safe.aiml
0,WHAT IS YOUR FAVORITE VERSE,*,*,<srai>what is your favorite bible verse</srai>,reduction3.safe.aiml
0,WHAT IS A GOOD BEER,*,*,<srai>what is your favorite beer</srai>,reduction3.safe.aiml
0,DO YOU KNOW BANDS,*,*,<srai>what is your favorite band</srai>,reduction3.safe.aiml
0,WHAT IS YOUR FAVORITE BAND *,*,*,<srai>what is your favorite band</srai>,reduction3.safe.aiml
0,WHAT IS YOUR FAVORITE MUSIC GROUP,*,*,<srai>what is your favorite band</srai>,reduction3.safe.aiml
0,WHAT IS YOUR FAVORITE ANIMAL *,*,*,<srai>what is your favorite animal</srai>,reduction3.safe.aiml
0,WHAT IS YOUR FAVORITE PET,*,*,<srai>what is your favorite animal</srai>,reduction3.safe.aiml
0,WHAT KIND OF * DO YOU LIKE,*,*,<srai>WHAT IS YOUR FAVORITE <star/></srai>,reduction3.safe.aiml
0,DO YOU HAVE A * YOU LIKE,*,*,<srai>what is your favorite <star/></srai>,reduction3.safe.aiml
0,DO YOU HAVE A FAVORITE *,*,*,<srai>what is your favorite <star/></srai>,reduction3.safe.aiml
0,TELL ME ABOUT YOUR FAVORITE *,*,*,<srai>what is your favorite <star/></srai>,reduction3.safe.aiml
0,WHAT * DO YOU LIKE BEST,*,*,<srai>what is your favorite <star/></srai>,reduction3.safe.aiml
0,WHAT IS THE * YOU LIKE MOST,*,*,<srai>what is your favorite <star/></srai>,reduction3.safe.aiml
0,WHAT IS YOUR MOST TREASURED *,*,*,<srai>what is your favorite <star/></srai>,reduction3.safe.aiml
0,WHAT IS DR RICHARDS EMAIL *,*,*,<srai>what is your email</srai>,reduction3.safe.aiml
0,WHAT IS YOUR E MAIL *,*,*,<srai>what is your e mail</srai>,reduction3.safe.aiml
0,WHAT IS YOUR EMAIL,*,*,<srai>what is your e mail</srai>,reduction3.safe.aiml
0,DO YOU HAVE AN E MAIL *,*,*,<srai>what is your e mail address</srai>,reduction3.safe.aiml
0,DO YOU HAVE AN E MAIL,*,*,<srai>what is your e mail address</srai>,reduction3.safe.aiml
0,DO YOU HAVE AN EMAIL,*,*,<srai>what is your e mail address</srai>,reduction3.safe.aiml
0,WHAT IS YOUR IP *,*,*,<srai>what is your dns</srai>,reduction3.safe.aiml
0,WHAT KIND OF CPU *,*,*,<srai>what is your cpu</srai>,reduction3.safe.aiml
0,TELL ME ABOUT YOUR BRAIN,*,*,<srai>what is your brain</srai>,reduction3.safe.aiml
0,WHERE DO YOU COME FROM,*,*,<srai>WHAT IS YOUR BIRTHPLACE</srai>,reduction3.safe.aiml
0,WHERE WERE YOU BORN,*,*,<srai>WHAT IS YOUR BIRTHPLACE</srai>,reduction3.safe.aiml
0,WHERE DID YOU ORIGINATE,*,*,<srai>what is your birthplace</srai>,reduction3.safe.aiml
0,WHEN IS YOUR BIRTHDAY,*,*,<srai>WHAT IS YOUR BIRTHDAY</srai>,reduction3.safe.aiml
0,WHEN IS IT YOUR BIRTHDAY,*,*,<srai>what is your birthday</srai>,reduction3.safe.aiml
0,WHEN IS YOUR B *,*,*,<srai>what is your birthday</srai>,reduction3.safe.aiml
0,WHEN IS YOUR BD,*,*,<srai>what is your birthday</srai>,reduction3.safe.aiml
0,WHEN IS YOUR BIRTH *,*,*,<srai>what is your birthday</srai>,reduction3.safe.aiml
0,WHEN IS YOUR BIRTHDATE,*,*,<srai>what is your birthday</srai>,reduction3.safe.aiml
0,WHEN IS YOUR BIRTHDAY *,*,*,<srai>what is your birthday</srai>,reduction3.safe.aiml
0,WHAT IS HIS ADDRESS,*,*,<srai>what is your address</srai>,reduction3.safe.aiml
0,WHERE SHOULD I SEND IT,*,*,<srai>what is your address</srai>,reduction3.safe.aiml
0,TELL ME ABOUT YOUR PLAN *,*,*,<srai>what is your <star/></srai>,reduction3.safe.aiml
0,WHAT IS YOU ARE *,*,*,<srai>what is your <star/></srai>,reduction3.safe.aiml
0,WHAT DO YOU THINK YOUR * IS,*,*,<srai>what is your <star/></srai>,reduction3.safe.aiml
0,WHAT IS YOUR BASIC *,*,*,<srai>what is your <star/></srai>,reduction3.safe.aiml
0,WHAT IS YOUR BEST *,*,*,<srai>what is your <star/></srai>,reduction3.safe.aiml
0,WHAT IS YOUR CURRENT *,*,*,<srai>what is your <star/></srai>,reduction3.safe.aiml
0,WHAT IS YOUR FULL *,*,*,<srai>what is your <star/></srai>,reduction3.safe.aiml
0,WHAT IS YOUR HIGHER *,*,*,<srai>what is your <star/></srai>,reduction3.safe.aiml
0,WHAT IS YOUR MAIN *,*,*,<srai>what is your <star/></srai>,reduction3.safe.aiml
0,WHAT IS YOUR MAJOR *,*,*,<srai>what is your <star/></srai>,reduction3.safe.aiml
0,WHAT IS YOUR MOST *,*,*,<srai>what is your <star/></srai>,reduction3.safe.aiml
0,WHAT IS YOUR OFFICIAL *,*,*,<srai>what is your <star/></srai>,reduction3.safe.aiml
0,WHAT IS YOUR PARTICULAR *,*,*,<srai>what is your <star/></srai>,reduction3.safe.aiml
0,WHAT IS YOUR PRIME *,*,*,<srai>what is your <star/></srai>,reduction3.safe.aiml
0,WHAT IS YOUR ULTIMATE *,*,*,<srai>what is your <star/></srai>,reduction3.safe.aiml
0,WHAT IS YOUR USUAL *,*,*,<srai>what is your <star/></srai>,reduction3.safe.aiml
0,ARE YOU Y2K COMPLIANT,*,*,<srai>what is y2k</srai>,reduction3.safe.aiml
0,WHAT DO YOU THINK ABOUT Y2K,*,*,<srai>what is y2k</srai>,reduction3.safe.aiml
0,DO YOU KNOW XML,*,*,<srai>what is xml</srai>,reduction3.safe.aiml
0,TELL ME ABOUT XML,*,*,<srai>what is xml</srai>,reduction3.safe.aiml
0,WHAT DO YOU THINK ABOUT XML,*,*,<srai>what is xml</srai>,reduction3.safe.aiml
0,XML,*,*,<srai>what is xml</srai>,reduction3.safe.aiml
0,WHAT IS WWF *,*,*,<srai>what is wwf</srai>,reduction3.safe.aiml
0,WHAT IS WRONG ARE *,*,*,<srai>what is wrong</srai>. <srai>are <star/></srai>,reduction3.safe.aiml
0,TELL ME ABOUT WORLD *,*,*,<srai>what is world <star/></srai>,reduction3.safe.aiml
0,WHAT DO YOU THINK ABOUT WINTER,*,*,<srai>what is winter</srai>,reduction3.safe.aiml
0,TELL ME ABOUT WINDOWS,*,*,<srai>what is windows</srai>,reduction3.safe.aiml
0,WHAT DO YOU KNOW ABOUT WINDOWS,*,*,<srai>what is windows</srai>,reduction3.safe.aiml
0,WHAT DO YOU THINK ABOUT WINDOWS,*,*,<srai>what is windows</srai>,reduction3.safe.aiml
0,WHAT DO YOU THINK ABOUT WINDOWS *,*,*,<srai>what is windows <star/></srai>,reduction3.safe.aiml
0,WHAT DO YOU THINK ABOUT WEBTV,*,*,<srai>what is webtv</srai>,reduction3.safe.aiml
0,TELL ME ABOUT WAR,*,*,<srai>what is war</srai>,reduction3.safe.aiml
0,WHAT DO YOU THINK ABOUT WARS,*,*,<srai>what is war</srai>,reduction3.safe.aiml
0,WHAT IS WAR *,*,*,<srai>what is war</srai>,reduction3.safe.aiml
0,WHAT DO YOU THINK ABOUT VRML,*,*,<srai>what is vrml</srai>,reduction3.safe.aiml
0,TELL ME ABOUT VOYAGER,*,*,<srai>what is voyager</srai>,reduction3.safe.aiml
0,TELL ME ABOUT VMWARE,*,*,<srai>what is vmware</srai>,reduction3.safe.aiml
0,WHAT DO YOU KNOW ABOUT VISUAL BASIC,*,*,<srai>what is visual basic</srai>,reduction3.safe.aiml
0,DO YOU KNOW VB,*,*,<srai>what is vb</srai>,reduction3.safe.aiml
0,TELL ME ABOUT URANUS,*,*,<srai>what is uranus</srai>,reduction3.safe.aiml
0,SUP,*,*,<srai>WHAT IS UP</srai>,reduction3.safe.aiml
0,WHAT IS HAPPENING,*,*,<srai>WHAT IS UP</srai>,reduction3.safe.aiml
0,WHAT IS NEW,*,*,<srai>WHAT IS UP</srai>,reduction3.safe.aiml
0,HEY WHAT IS UP,*,*,<srai>what is up</srai>,reduction3.safe.aiml
0,SO WHAT IS UP,*,*,<srai>what is up</srai>,reduction3.safe.aiml
0,WASSAP,*,*,<srai>what is up</srai>,reduction3.safe.aiml
0,WASSSUP,*,*,<srai>what is up</srai>,reduction3.safe.aiml
0,WASSUP,*,*,<srai>what is up</srai>,reduction3.safe.aiml
0,WAZUP,*,*,<srai>what is up</srai>,reduction3.safe.aiml
