0,WHAT IS JEEVES,*,*,<srai>who is jeeves</srai>,reduction3.safe.aiml
0,WHERE IS JEEVES,*,*,<srai>who is jeeves</srai>,reduction3.safe.aiml
0,WHO IS JEEVES *,*,*,<srai>who is jeeves</srai>,reduction3.safe.aiml
0,DO YOU KNOW JEAN,*,*,<srai>who is jean</srai>,reduction3.safe.aiml
0,DO YOU KNOW JEAN *,*,*,<srai>who is jean <star/></srai>,reduction3.safe.aiml
0,DO YOU KNOW JASON,*,*,<srai>who is jason</srai>,reduction3.safe.aiml
0,WHAT IS JASON,*,*,<srai>who is jason</srai>,reduction3.safe.aiml
0,DO YOU READ JANE *,*,*,<srai>who is jane <star/></srai>,reduction3.safe.aiml
0,DO YOU KNOW JAMES,*,*,<srai>who is james</srai>,reduction3.safe.aiml
0,WHO IS BOND,*,*,<srai>who is james bond</srai>,reduction3.safe.aiml
0,DO YOU KNOW JAMES *,*,*,<srai>who is james <star/></srai>,reduction3.safe.aiml
0,DO YOU KNOW JACOB,*,*,<srai>who is jacob</srai>,reduction3.safe.aiml
0,DO YOU KNOW JACK,*,*,<srai>who is jack</srai>,reduction3.safe.aiml
0,DO YOU KNOW JACK *,*,*,<srai>who is jack <star/></srai>,reduction3.safe.aiml
0,DO YOU KNOW JACCO BIKKER,*,*,<srai>who is jacco <star/></srai>,reduction3.safe.aiml
0,DO YOU KNOW ISAAC ASIMOV,*,*,<srai>who is isaac asimov</srai>,reduction3.safe.aiml
0,WHAT DO YOU THINK ABOUT ISAAC ASIMOV,*,*,<srai>who is isaac asimov</srai>,reduction3.safe.aiml
0,WHAT IS ISAAC ASIMOV,*,*,<srai>who is isaac asimov</srai>,reduction3.safe.aiml
0,WHO IS ASIMOV,*,*,<srai>who is isaac asimov</srai>,reduction3.safe.aiml
0,DO YOU KNOW ISAAC *,*,*,<srai>who is isaac <star/></srai>,reduction3.safe.aiml
0,DO YOU READ ISAAC *,*,*,<srai>who is isaac <star/></srai>,reduction3.safe.aiml
0,WHAT DO YOU THINK ABOUT IMMANUEL KANT,*,*,<srai>who is immanuel kant</srai>,reduction3.safe.aiml
0,DO YOU KNOW IAN,*,*,<srai>who is ian</srai>,reduction3.safe.aiml
0,DO YOU KNOW HULK HOGAN,*,*,<srai>who is hulk hogan</srai>,reduction3.safe.aiml
0,DO YOU KNOW HUGH LOEBNER,*,*,<srai>who is hugh loebner</srai>,reduction3.safe.aiml
0,TELL ME ABOUT HUGH LOEBNER,*,*,<srai>who is hugh loebner</srai>,reduction3.safe.aiml
0,WHO IS DR LOEBNER,*,*,<srai>who is hugh loebner</srai>,reduction3.safe.aiml
0,DO YOU KNOW HUGH GRANT,*,*,<srai>who is hugh grant</srai>,reduction3.safe.aiml
0,WHAT DO YOU THINK ABOUT HOWARD STERN,*,*,<srai>who is howard stern</srai>,reduction3.safe.aiml
0,DO YOU KNOW HOMER SIMPSON,*,*,<srai>who is homer simpson</srai>,reduction3.safe.aiml
0,DO YOU KNOW ADOLF HITLER,*,*,<srai>who is hitler</srai>,reduction3.safe.aiml
0,DO YOU KNOW ADOLPH HITLER,*,*,<srai>who is hitler</srai>,reduction3.safe.aiml
0,DO YOU KNOW HITLER,*,*,<srai>who is hitler</srai>,reduction3.safe.aiml
0,HITLER,*,*,<srai>who is hitler</srai>,reduction3.safe.aiml
0,HOW IS HITLER,*,*,<srai>who is hitler</srai>,reduction3.safe.aiml
0,WHAT ABOUT HITLER *,*,*,<srai>who is hitler</srai>,reduction3.safe.aiml
0,WHAT DO YOU THINK ABOUT HITLER,*,*,<srai>who is hitler</srai>,reduction3.safe.aiml
0,WHO IS * HITLER,*,*,<srai>who is hitler</srai>,reduction3.safe.aiml
0,WHO IS ADOLF HITLER,*,*,<srai>who is hitler</srai>,reduction3.safe.aiml
0,DO YOU KNOW HEX,*,*,<srai>who is hex</srai>,reduction3.safe.aiml
0,DO YOU KNOW HERBERT *,*,*,<srai>who is herbert <star/></srai>,reduction3.safe.aiml
0,WHO IS THOREAU,*,*,<srai>who is henry david thoreau</srai>,reduction3.safe.aiml
0,DO YOU KNOW HENRIK,*,*,<srai>who is henrik</srai>,reduction3.safe.aiml
0,DO YOU KNOW HEIDI,*,*,<srai>who is heidi</srai>,reduction3.safe.aiml
0,WHAT IS HEIDI,*,*,<srai>who is heidi</srai>,reduction3.safe.aiml
0,WHAT IS HEGEL,*,*,<srai>who is hegel</srai>,reduction3.safe.aiml
0,WHAT IS HE,*,*,<srai>who is he</srai>,reduction3.safe.aiml
0,WHO IS HE *,*,*,<srai>who is he</srai>,reduction3.safe.aiml
0,WHO IS HIM,*,*,<srai>who is he</srai>,reduction3.safe.aiml
0,WHO IS HIMSELF,*,*,<srai>who is he</srai>,reduction3.safe.aiml
0,DO YOU KNOW HARVEY,*,*,<srai>who is harvey</srai>,reduction3.safe.aiml
0,DO YOU KNOW HARRY *,*,*,<srai>who is harry <star/></srai>,reduction3.safe.aiml
0,WHAT DO YOU THINK ABOUT HARRISON FORD,*,*,<srai>who is harrison ford</srai>,reduction3.safe.aiml
0,DO YOU KNOW HARRISON *,*,*,<srai>who is harrison <star/></srai>,reduction3.safe.aiml
0,DO YOU KNOW HANSON,*,*,<srai>who is hanson</srai>,reduction3.safe.aiml
0,WHAT DO YOU THINK ABOUT HANS MORAVEC,*,*,<srai>who is hans moravec</srai>,reduction3.safe.aiml
0,WHAT IS HANS MORAVEC,*,*,<srai>who is hans moravec</srai>,reduction3.safe.aiml
0,WHO IS MORAVEC,*,*,<srai>who is hans moravec</srai>,reduction3.safe.aiml
0,DO YOU KNOW HANS *,*,*,<srai>who is hans <star/></srai>,reduction3.safe.aiml
0,TELL ME ABOUT HANS *,*,*,<srai>who is hans <star/></srai>,reduction3.safe.aiml
0,DO YOU KNOW HANNAH,*,*,<srai>who is hannah</srai>,reduction3.safe.aiml
0,DO YOU KNOW HAMLET,*,*,<srai>who is hamlet</srai>,reduction3.safe.aiml
0,WHAT DO YOU THINK ABOUT HAL,*,*,<srai>who is hal</srai>,reduction3.safe.aiml
0,WHO IS H A L,*,*,<srai>who is hal</srai>,reduction3.safe.aiml
0,DO YOU KNOW H *,*,*,<srai>who is h <star/></srai>,reduction3.safe.aiml
0,DO YOU KNOW GREG,*,*,<srai>who is greg</srai>,reduction3.safe.aiml
0,DO YOU KNOW GREG *,*,*,<srai>who is greg <star/></srai>,reduction3.safe.aiml
0,WHO IS GORBACHOV,*,*,<srai>who is gorbachev</srai>,reduction3.safe.aiml
0,DO YOU KNOW GODEL,*,*,<srai>who is godel</srai>,reduction3.safe.aiml
0,DO YOU KNOW GIGI *,*,*,<srai>who is gigi <star/></srai>,reduction3.safe.aiml
0,WHAT IS GHANDI,*,*,<srai>who is ghandi</srai>,reduction3.safe.aiml
0,TELL ME ABOUT GERTRUDE STEIN,*,*,<srai>who is gertrude stein</srai>,reduction3.safe.aiml
0,DO YOU KNOW GEORGE,*,*,<srai>who is george</srai>,reduction3.safe.aiml
0,WHO IS GEORGE WASHINGTON *,*,*,<srai>who is george washington</srai>,reduction3.safe.aiml
0,WHO IS THE FIRST PRESIDENT *,*,*,<srai>who is george washington</srai>,reduction3.safe.aiml
0,WHO IS WASHINGTON,*,*,<srai>who is george washington</srai>,reduction3.safe.aiml
0,WHO WAS THE FIRST PRESIDENT *,*,*,<srai>who is george washington</srai>,reduction3.safe.aiml
0,WHO WAS THE FIRST PRESIDENT,*,*,<srai>who is george washington</srai>,reduction3.safe.aiml
0,WHAT IS GEORGE W BUSH,*,*,<srai>who is george w bush</srai>,reduction3.safe.aiml
0,BUSH,*,*,<srai>who is george bush</srai>,reduction3.safe.aiml
0,GEORGE BUSH,*,*,<srai>who is george bush</srai>,reduction3.safe.aiml
0,WHAT DO YOU THINK ABOUT GEORGE BUSH,*,*,<srai>who is george bush</srai>,reduction3.safe.aiml
0,WHO IS BUSH,*,*,<srai>who is george bush</srai>,reduction3.safe.aiml
0,WHO IS GEORGE BUSH *,*,*,<srai>who is george bush</srai>,reduction3.safe.aiml
0,WHO IS GEORGE W *,*,*,<srai>who is george bush</srai>,reduction3.safe.aiml
0,WHO IS GEORGE BUSH JUNIOR,*,*,<srai>who is george bush jr</srai>,reduction3.safe.aiml
0,DO YOU KNOW GEORGE *,*,*,<srai>who is george <star/></srai>,reduction3.safe.aiml
0,TELL ME ABOUT GEORGE *,*,*,<srai>who is george <star/></srai>,reduction3.safe.aiml
0,WHAT DO YOU THINK ABOUT GEORGE *,*,*,<srai>who is george <star/></srai>,reduction3.safe.aiml
0,WHO IS FREDERICH GAUSS,*,*,<srai>who is gauss</srai>,reduction3.safe.aiml
0,DO YOU KNOW GANDHI,*,*,<srai>who is gandhi</srai>,reduction3.safe.aiml
0,WHO IS GHANDI,*,*,<srai>who is gandhi</srai>,reduction3.safe.aiml
0,WHO IS MAHATMA GANDHI,*,*,<srai>who is gandhi</srai>,reduction3.safe.aiml
0,DO YOU KNOW FREUD,*,*,<srai>who is freud</srai>,reduction3.safe.aiml
0,WHAT DO YOU KNOW ABOUT FREUD,*,*,<srai>who is freud</srai>,reduction3.safe.aiml
0,WHAT DO YOU THINK ABOUT FREUD,*,*,<srai>who is freud</srai>,reduction3.safe.aiml
0,WHAT IS FREUD,*,*,<srai>who is freud</srai>,reduction3.safe.aiml
0,WHO IS SIGMUND FREUD,*,*,<srai>who is freud</srai>,reduction3.safe.aiml
0,DO YOU KNOW FRED,*,*,<srai>who is fred</srai>,reduction3.safe.aiml
0,WHO IS FDR,*,*,<srai>who is franklin roosevelt</srai>,reduction3.safe.aiml
0,DO YOU KNOW FRANK,*,*,<srai>who is frank</srai>,reduction3.safe.aiml
0,DO YOU KNOW FRANK *,*,*,<srai>who is frank <star/></srai>,reduction3.safe.aiml
0,DO YOU KNOW FORD PREFECT,*,*,<srai>who is ford prefect</srai>,reduction3.safe.aiml
0,WHAT DO YOU THINK ABOUT * CASTRO,*,*,<srai>who is fidel castro</srai>,reduction3.safe.aiml
0,DO YOU KNOW FERMAT,*,*,<srai>who is fermat</srai>,reduction3.safe.aiml
0,DO YOU KNOW FELIX,*,*,<srai>who is felix</srai>,reduction3.safe.aiml
0,DO YOU KNOW EUCLID,*,*,<srai>who is euclid</srai>,reduction3.safe.aiml
0,DO YOU KNOW ERIC,*,*,<srai>who is eric</srai>,reduction3.safe.aiml
0,DO YOU KNOW ERIC *,*,*,<srai>who is eric <star/></srai>,reduction3.safe.aiml
0,DO YOU KNOW ERASMUS *,*,*,<srai>who is erasmus <star/></srai>,reduction3.safe.aiml
0,DO YOU KNOW EMMYLOU *,*,*,<srai>who is emmylou <star/></srai>,reduction3.safe.aiml
0,DO YOU KNOW EMMA,*,*,<srai>who is emma</srai>,reduction3.safe.aiml
0,DO YOU KNOW EMILY,*,*,<srai>who is emily</srai>,reduction3.safe.aiml
0,DO YOU KNOW E L I V S,*,*,<srai>who is elvis</srai>,reduction3.safe.aiml
0,DO YOU KNOW ELVIS,*,*,<srai>who is elvis</srai>,reduction3.safe.aiml
0,ELVIS IS DEAD,*,*,<srai>who is elvis</srai>,reduction3.safe.aiml
0,ELVIS WHO,*,*,<srai>who is elvis</srai>,reduction3.safe.aiml
0,ELVIS,*,*,<srai>who is elvis</srai>,reduction3.safe.aiml
0,IS ELVIS ALIVE,*,*,<srai>who is elvis</srai>,reduction3.safe.aiml
0,IS ELVIS DEAD,*,*,<srai>who is elvis</srai>,reduction3.safe.aiml
0,TELL ME ABOUT ELVIS *,*,*,<srai>who is elvis</srai>,reduction3.safe.aiml
0,TELL ME ABOUT ELVIS,*,*,<srai>who is elvis</srai>,reduction3.safe.aiml
0,WHAT DO YOU THINK ABOUT ELVIS,*,*,<srai>who is elvis</srai>,reduction3.safe.aiml
0,WHAT IS E L V I S,*,*,<srai>who is elvis</srai>,reduction3.safe.aiml
0,WHAT IS ELVIS *,*,*,<srai>who is elvis</srai>,reduction3.safe.aiml
0,WHAT IS ELVIS,*,*,<srai>who is elvis</srai>,reduction3.safe.aiml
0,WHO ARE ELVIS *,*,*,<srai>who is elvis</srai>,reduction3.safe.aiml
0,WHO IS E L V *,*,*,<srai>who is elvis</srai>,reduction3.safe.aiml
0,WHO IS ELIVS,*,*,<srai>who is elvis</srai>,reduction3.safe.aiml
0,WHO IS ELVES,*,*,<srai>who is elvis</srai>,reduction3.safe.aiml
0,WHO IS ELVICE,*,*,<srai>who is elvis</srai>,reduction3.safe.aiml
0,WHO IS ELVID,*,*,<srai>who is elvis</srai>,reduction3.safe.aiml
0,WHO IS ELVIS *,*,*,<srai>who is elvis</srai>,reduction3.safe.aiml
0,WHO IS THIS ELVIS GUY,*,*,<srai>who is elvis</srai>,reduction3.safe.aiml
0,WHY ELVIS,*,*,<srai>who is elvis</srai>,reduction3.safe.aiml
0,DO YOU KNOW ELVIS *,*,*,<srai>who is elvis <star/></srai>,reduction3.safe.aiml
0,DO YOU KNOW ELTON *,*,*,<srai>who is elton <star/></srai>,reduction3.safe.aiml
0,ELIZA,*,*,<srai>who is eliza</srai>,reduction3.safe.aiml
0,DO YOU KNOW ELECTRA,*,*,<srai>who is electra</srai>,reduction3.safe.aiml
0,WHAT IS ELECTRA,*,*,<srai>who is electra</srai>,reduction3.safe.aiml
0,DO YOU KNOW EINSTEIN,*,*,<srai>who is einstein</srai>,reduction3.safe.aiml
0,EINSTEIN,*,*,<srai>who is einstein</srai>,reduction3.safe.aiml
0,TELL ME ABOUT EINSTEIN,*,*,<srai>who is einstein</srai>,reduction3.safe.aiml
0,WHAT DO YOU KNOW ABOUT EINSTEIN,*,*,<srai>who is einstein</srai>,reduction3.safe.aiml
0,WHAT DO YOU THINK ABOUT EINSTEIN,*,*,<srai>who is einstein</srai>,reduction3.safe.aiml
0,WHAT IS EINSTEIN,*,*,<srai>who is einstein</srai>,reduction3.safe.aiml
0,WHAT IS EINSTIEN,*,*,<srai>who is einstein</srai>,reduction3.safe.aiml
0,WHO IS EINSTINE,*,*,<srai>who is einstein</srai>,reduction3.safe.aiml
0,DO YOU KNOW EDWARD,*,*,<srai>who is edward</srai>,reduction3.safe.aiml
0,DO YOU KNOW EDGAR *,*,*,<srai>who is edgar <star/></srai>,reduction3.safe.aiml
0,DO YOU KNOW E T,*,*,<srai>who is e t</srai>,reduction3.safe.aiml
0,DO YOU REMEMBER DYLAN,*,*,<srai>who is dylan</srai>,reduction3.safe.aiml
0,DO YOU KNOW DREW CAREY,*,*,<srai>who is drew <star/></srai>,reduction3.safe.aiml
0,WHO IS RICHARD WALLACE,*,*,<srai>WHO IS DR WALLACE</srai>,reduction3.safe.aiml
0,DO YOU KNOW DR,*,*,<srai>who is dr wallace</srai>,reduction3.safe.aiml
0,DO YOU KNOW DR *,*,*,<srai>WHO IS DR <star/></srai>,reduction3.safe.aiml
0,TELL ME ABOUT DR *,*,*,<srai>who is dr <star/></srai>,reduction3.safe.aiml
0,WHO IS THE DR *,*,*,<srai>who is dr <star/></srai>,reduction3.safe.aiml
0,WHAT DO YOU KNOW ABOUT DR *,*,*,<srai>who is dr <star/></srai>,reduction3.safe.aiml
0,WHAT DO YOU THINK ABOUT DR *,*,*,<srai>who is dr <star/></srai>,reduction3.safe.aiml
0,WHAT DO YOU THINK OF DR *,*,*,<srai>who is dr <star/></srai>,reduction3.safe.aiml
0,DO YOU LIKE DOUGLAS ADAMS,*,*,<srai>who is douglas adams</srai>,reduction3.safe.aiml
0,DO YOU KNOW DOUGLAS *,*,*,<srai>who is douglas <star/></srai>,reduction3.safe.aiml
0,TELL ME ABOUT DOUGLAS *,*,*,<srai>who is douglas <star/></srai>,reduction3.safe.aiml
0,WHAT DO YOU THINK ABOUT DOUGLAS *,*,*,<srai>who is douglas <star/></srai>,reduction3.safe.aiml
0,DO YOU KNOW DOUG *,*,*,<srai>who is doug <star/></srai>,reduction3.safe.aiml
0,DO YOU KNOW DONALD *,*,*,<srai>who is donald <star/></srai>,reduction3.safe.aiml
0,DO YOU KNOW DOCTOR *,*,*,<srai>who is doctor <star/></srai>,reduction3.safe.aiml
0,TELL ME ABOUT DOCTOR *,*,*,<srai>who is doctor <star/></srai>,reduction3.safe.aiml
0,WHO IS THIS DOCTOR *,*,*,<srai>who is doctor <star/></srai>,reduction3.safe.aiml
0,WHAT IS DILBERT,*,*,<srai>who is dilbert</srai>,reduction3.safe.aiml
0,COGITO ERGO SUM,*,*,<srai>who is descartes</srai>,reduction3.safe.aiml
0,DO YOU KNOW * DESCARTES,*,*,<srai>who is descartes</srai>,reduction3.safe.aiml
0,DO YOU KNOW DESCARTES,*,*,<srai>who is descartes</srai>,reduction3.safe.aiml
0,DO YOU KNOW DEREK,*,*,<srai>who is derek</srai>,reduction3.safe.aiml
0,DO YOU KNOW DEREK *,*,*,<srai>who is derek <star/></srai>,reduction3.safe.aiml
0,WHAT DO YOU THINK ABOUT DENISE *,*,*,<srai>who is denise <star/></srai>,reduction3.safe.aiml
0,WHAT DO YOU THINK ABOUT DEEPBLUE,*,*,<srai>who is deep blue</srai>,reduction3.safe.aiml
0,WHAT IS DEEP BLUE,*,*,<srai>who is deep blue</srai>,reduction3.safe.aiml
0,DO YOU KNOW DE NIRO,*,*,<srai>who is de niro</srai>,reduction3.safe.aiml
0,WHAT IS CAM BRAIN,*,*,<srai>who is de garis</srai>,reduction3.safe.aiml
0,WHAT IS DAVIS,*,*,<srai>who is davis</srai>,reduction3.safe.aiml
0,DO YOU KNOW DAVID,*,*,<srai>who is david</srai>,reduction3.safe.aiml
0,TELL ME ABOUT DAVID,*,*,<srai>who is david</srai>,reduction3.safe.aiml
0,WHO IS DB,*,*,<srai>who is david bacon</srai>,reduction3.safe.aiml
0,WHO IS MR BABON,*,*,<srai>who is david bacon</srai>,reduction3.safe.aiml
0,DO YOU KNOW DAVID *,*,*,<srai>who is david <star/></srai>,reduction3.safe.aiml
0,WHAT DO YOU THINK ABOUT DAVID *,*,*,<srai>who is david <star/></srai>,reduction3.safe.aiml
0,DO YOU KNOW DAVE,*,*,<srai>who is dave</srai>,reduction3.safe.aiml
0,DO YOU KNOW DAVE BOWMAN,*,*,<srai>who is dave bowman</srai>,reduction3.safe.aiml
0,DO YOU KNOW DAVE *,*,*,<srai>who is dave <star/></srai>,reduction3.safe.aiml
0,WHAT DO YOU THINK ABOUT DAVE *,*,*,<srai>who is dave <star/></srai>,reduction3.safe.aiml
0,DO YOU KNOW COMMANDER DATA,*,*,<srai>who is data</srai>,reduction3.safe.aiml
0,DO YOU KNOW DATA *,*,*,<srai>who is data</srai>,reduction3.safe.aiml
0,DO YOU KNOW DATA,*,*,<srai>who is data</srai>,reduction3.safe.aiml
0,DO YOU KNOW DANTE,*,*,<srai>who is dante</srai>,reduction3.safe.aiml
0,DO YOU KNOW DANNY,*,*,<srai>who is danny</srai>,reduction3.safe.aiml
0,DO YOU KNOW DANIEL,*,*,<srai>who is daniel</srai>,reduction3.safe.aiml
0,WHAT IS DANIEL,*,*,<srai>who is daniel</srai>,reduction3.safe.aiml
0,DO YOU KNOW DANIEL *,*,*,<srai>who is daniel <star/></srai>,reduction3.safe.aiml
0,DO YOU KNOW DANEEL,*,*,<srai>who is daneel</srai>,reduction3.safe.aiml
0,DO YOU KNOW DAN,*,*,<srai>who is dan</srai>,reduction3.safe.aiml
0,DO YOU KNOW COMMANDER *,*,*,<srai>who is commander <star/></srai>,reduction3.safe.aiml
0,DO YOU KNOW COG,*,*,<srai>who is cog</srai>,reduction3.safe.aiml
0,TELL ME ABOUT CLINTON,*,*,<srai>who is clinton</srai>,reduction3.safe.aiml
0,WHAT DO YOU THINK ABOUT CLINTON,*,*,<srai>who is clinton</srai>,reduction3.safe.aiml
0,WHAT DO YOU THINK ABOUT CLAIRE,*,*,<srai>who is claire</srai>,reduction3.safe.aiml
0,DO YOU KNOW CINDY,*,*,<srai>who is cindy</srai>,reduction3.safe.aiml
0,DO YOU KNOW CHUCK,*,*,<srai>who is chuck</srai>,reduction3.safe.aiml
0,WHO IS COLOMBUS,*,*,<srai>who is christopher columbus</srai>,reduction3.safe.aiml
0,WHO IS COLUMBUS,*,*,<srai>who is christopher columbus</srai>,reduction3.safe.aiml
0,DO YOU KNOW CHRISTOPHER *,*,*,<srai>who is christopher <star/></srai>,reduction3.safe.aiml
0,DO YOU KNOW CHRISTIAN *,*,*,<srai>who is christian <star/></srai>,reduction3.safe.aiml
0,DO YOU KNOW CHRIS,*,*,<srai>who is chris</srai>,reduction3.safe.aiml
0,DO YOU KNOW CHRIS *,*,*,<srai>who is chris <star/></srai>,reduction3.safe.aiml
0,DO YOU KNOW CHOPIN,*,*,<srai>who is chopin</srai>,reduction3.safe.aiml
0,DO YOU KNOW CHEWBACCA,*,*,<srai>who is chewbacca</srai>,reduction3.safe.aiml
0,DO YOU KNOW CHER,*,*,<srai>who is cher</srai>,reduction3.safe.aiml
0,DO YOU KNOW CHELSEA *,*,*,<srai>who is chelsea <star/></srai>,reduction3.safe.aiml
0,DO YOU KNOW CHARLIE,*,*,<srai>who is charlie</srai>,reduction3.safe.aiml
0,DO YOU KNOW CHARLIE *,*,*,<srai>who is charlie <star/></srai>,reduction3.safe.aiml
0,WHAT DO YOU THINK ABOUT CHARLES DARWIN,*,*,<srai>who is charles darwin</srai>,reduction3.safe.aiml
0,DO YOU KNOW CATHERINE *,*,*,<srai>who is catherine <star/></srai>,reduction3.safe.aiml
0,DO YOU KNOW CASSIDY,*,*,<srai>who is cassidy</srai>,reduction3.safe.aiml
0,DO YOU KNOW CASEY,*,*,<srai>who is casey</srai>,reduction3.safe.aiml
0,DO YOU KNOW CAROLYN,*,*,<srai>who is carolyn</srai>,reduction3.safe.aiml
0,DO YOU KNOW CAROL,*,*,<srai>who is carol</srai>,reduction3.safe.aiml
0,WHAT IS CARNEGIE,*,*,<srai>who is carnegie</srai>,reduction3.safe.aiml
0,DO YOU KNOW CARMEN *,*,*,<srai>who is carmen <star/></srai>,reduction3.safe.aiml
0,DO YOU KNOW CARLOS *,*,*,<srai>who is carlos</srai>,reduction3.safe.aiml
0,DO YOU KNOW CARLOS,*,*,<srai>who is carlos</srai>,reduction3.safe.aiml
0,DO YOU KNOW CARL,*,*,<srai>who is carl</srai>,reduction3.safe.aiml
0,WHO IS JUNG,*,*,<srai>who is carl jung</srai>,reduction3.safe.aiml
0,DO YOU KNOW CAREL CAPEK,*,*,<srai>who is carel capek</srai>,reduction3.safe.aiml
0,WHAT IS CAREL CAPEK,*,*,<srai>who is carel capek</srai>,reduction3.safe.aiml
0,WHO IS PICARD,*,*,<srai>who is captain picard</srai>,reduction3.safe.aiml
0,DO YOU KNOW CAPTAIN *,*,*,<srai>who is captain <star/></srai>,reduction3.safe.aiml
0,DO YOU KNOW CAMERON *,*,*,<srai>who is cameron <star/></srai>,reduction3.safe.aiml
0,DO YOU KNOW CALIGULA,*,*,<srai>who is caligula</srai>,reduction3.safe.aiml
0,DO YOU KNOW C 3PO,*,*,<srai>who is c3po</srai>,reduction3.safe.aiml
0,DO YOU KNOW C3PO *,*,*,<srai>who is c3po</srai>,reduction3.safe.aiml
0,DO YOU KNOW C3PO,*,*,<srai>who is c3po</srai>,reduction3.safe.aiml
0,DO YOU KNOW CP3O,*,*,<srai>who is c3po</srai>,reduction3.safe.aiml
0,WHO IS C 3PO,*,*,<srai>who is c3po</srai>,reduction3.safe.aiml
0,DO YOU KNOW C3P0,*,*,<srai>who is c3p0</srai>,reduction3.safe.aiml
0,DO YOU KNOW BUSTER *,*,*,<srai>who is buster <star/></srai>,reduction3.safe.aiml
0,DO YOU KNOW BUSH,*,*,<srai>who is bush</srai>,reduction3.safe.aiml
0,DO YOU KNOW BURAK,*,*,<srai>who is burak</srai>,reduction3.safe.aiml
0,DO YOU KNOW BUGS BUNNY,*,*,<srai>who is bugs bunny</srai>,reduction3.safe.aiml
0,DO YOU KNOW BUFFY,*,*,<srai>who is buffy</srai>,reduction3.safe.aiml
0,DO YOU KNOW BUDDY HOLLY,*,*,<srai>who is buddy holly</srai>,reduction3.safe.aiml
0,DO YOU KNOW BUDDHA,*,*,<srai>who is buddha</srai>,reduction3.safe.aiml
0,WHO IS BUDHA,*,*,<srai>who is buddha</srai>,reduction3.safe.aiml
0,DO YOU KNOW BRYAN,*,*,<srai>who is bryan</srai>,reduction3.safe.aiml
0,DO YOU KNOW BRUCE *,*,*,<srai>who is bruce <star/></srai>,reduction3.safe.aiml
0,DO YOU KNOW BRUCE STERLING,*,*,<srai>who is bruce <star/></srai>,reduction3.safe.aiml
0,DO YOU KNOW BROOKE *,*,*,<srai>who is brooke <star/></srai>,reduction3.safe.aiml
0,DO YOU KNOW BRITTA,*,*,<srai>who is britta</srai>,reduction3.safe.aiml
0,DO YOU KNOW BRITNEY *,*,*,<srai>who is britney <star/></srai>,reduction3.safe.aiml
0,DO YOU KNOW BRIAN,*,*,<srai>who is brian</srai>,reduction3.safe.aiml
0,DO YOU KNOW BRIAN *,*,*,<srai>who is brian <star/></srai>,reduction3.safe.aiml
0,WHAT DO YOU THINK ABOUT BRAD PITT,*,*,<srai>who is brad pitt</srai>,reduction3.safe.aiml
0,DO YOU KNOW BRAD *,*,*,<srai>who is brad <star/></srai>,reduction3.safe.aiml
0,DO YOU KNOW BONO,*,*,<srai>who is bono</srai>,reduction3.safe.aiml
0,DO YOU KNOW BOB,*,*,<srai>who is bob</srai>,reduction3.safe.aiml
0,TELL ME ABOUT BOB,*,*,<srai>who is bob</srai>,reduction3.safe.aiml
0,WHAT DO YOU THINK ABOUT BOB,*,*,<srai>who is bob</srai>,reduction3.safe.aiml
0,DO YOU KNOW BOB DYLAN,*,*,<srai>who is bob dylan</srai>,reduction3.safe.aiml
0,DO YOU KNOW BOB *,*,*,<srai>who is bob <star/></srai>,reduction3.safe.aiml
0,TELL ME ABOUT BOB *,*,*,<srai>who is bob <star/></srai>,reduction3.safe.aiml
0,DO YOU KNOW BJORK,*,*,<srai>who is bjork</srai>,reduction3.safe.aiml
0,DO YOU KNOW * BIN LADEN,*,*,<srai>who is bin laden</srai>,reduction3.safe.aiml
0,WHAT IS BIN LADEN,*,*,<srai>who is bin laden</srai>,reduction3.safe.aiml
0,WHO IS * BIN LADIN,*,*,<srai>who is bin laden</srai>,reduction3.safe.aiml
0,DO YOU KNOW BILLY,*,*,<srai>who is billy</srai>,reduction3.safe.aiml
0,DO YOU KNOW BILL,*,*,<srai>who is bill</srai>,reduction3.safe.aiml
0,TELL ME ABOUT BILL,*,*,<srai>who is bill</srai>,reduction3.safe.aiml
0,WHAT IS BILL,*,*,<srai>who is bill</srai>,reduction3.safe.aiml
0,DO YOU KNOW BILL GATES,*,*,<srai>who is bill gates</srai>,reduction3.safe.aiml
0,DO YOU KNOW BILLGATES,*,*,<srai>who is bill gates</srai>,reduction3.safe.aiml
0,TELL ME ABOUT BILL GATES,*,*,<srai>who is bill gates</srai>,reduction3.safe.aiml
0,WHAT DO YOU THINK ABOUT BILL GATES,*,*,<srai>who is bill gates</srai>,reduction3.safe.aiml
0,WHAT DO YOU THINK OF BILL GATES,*,*,<srai>who is bill gates</srai>,reduction3.safe.aiml
0,WHAT IS BILL GATES *,*,*,<srai>who is bill gates</srai>,reduction3.safe.aiml
0,WHAT IS BILL GATES,*,*,<srai>who is bill gates</srai>,reduction3.safe.aiml
0,WHO IS BIL GATES,*,*,<srai>who is bill gates</srai>,reduction3.safe.aiml
0,WHO IS BILL GAETS,*,*,<srai>who is bill gates</srai>,reduction3.safe.aiml
0,WHO IS BILL GATE,*,*,<srai>who is bill gates</srai>,reduction3.safe.aiml
0,WHO IS BILL GATES *,*,*,<srai>who is bill gates</srai>,reduction3.safe.aiml
0,WHO IS BILL GATS,*,*,<srai>who is bill gates</srai>,reduction3.safe.aiml
0,WHO IS BILLGATES,*,*,<srai>who is bill gates</srai>,reduction3.safe.aiml
0,WHO IS BILLS GATE,*,*,<srai>who is bill gates</srai>,reduction3.safe.aiml
0,WHO IS GATES,*,*,<srai>who is bill gates</srai>,reduction3.safe.aiml
0,WHO IS THE * OF MICROSOFT,*,*,<srai>who is bill gates</srai>,reduction3.safe.aiml
0,DO YOU KNOW * CLINTON,*,*,<srai>who is bill clinton</srai>,reduction3.safe.aiml
0,DO YOU KNOW CLINTON *,*,*,<srai>who is bill clinton</srai>,reduction3.safe.aiml
0,DO YOU KNOW CLINTON,*,*,<srai>who is bill clinton</srai>,reduction3.safe.aiml
0,WHAT ABOUT CLINTON,*,*,<srai>who is bill clinton</srai>,reduction3.safe.aiml
0,WHAT DO YOU THINK ABOUT BILL CLINTON,*,*,<srai>who is bill clinton</srai>,reduction3.safe.aiml
0,DO YOU KNOW BILL *,*,*,<srai>who is bill <star/></srai>,reduction3.safe.aiml
0,TELL ME ABOUT BILL *,*,*,<srai>who is bill <star/></srai>,reduction3.safe.aiml
0,WHAT DO YOU KNOW ABOUT BILL *,*,*,<srai>who is bill <star/></srai>,reduction3.safe.aiml
0,WHAT DO YOU THINK ABOUT BILL *,*,*,<srai>who is bill <star/></srai>,reduction3.safe.aiml
0,WHAT IS BIG BLUE,*,*,<srai>who is big blue</srai>,reduction3.safe.aiml
0,DO YOU KNOW BIG *,*,*,<srai>who is big <star/></srai>,reduction3.safe.aiml
0,DO YOU KNOW BEYONCE *,*,*,<srai>who is beyonce <star/></srai>,reduction3.safe.aiml
0,TELL ME ABOUT BEYONCE *,*,*,<srai>who is beyonce <star/></srai>,reduction3.safe.aiml
0,WHAT IS BETTER BRITNEY *,*,*,<srai>who is better <star/></srai>,reduction3.safe.aiml
0,DO YOU KNOW BENNY,*,*,<srai>who is benny</srai>,reduction3.safe.aiml
0,DO YOU KNOW BENDER *,*,*,<srai>who is bender <star/></srai>,reduction3.safe.aiml
0,DO YOU KNOW BEN,*,*,<srai>who is ben</srai>,reduction3.safe.aiml
0,DO YOU KNOW BEN *,*,*,<srai>who is ben <star/></srai>,reduction3.safe.aiml
0,WHAT IS BATMAN *,*,*,<srai>who is batman</srai>,reduction3.safe.aiml
0,DO YOU KNOW BART *,*,*,<srai>who is bart <star/></srai>,reduction3.safe.aiml
0,BARRY,*,*,<srai>who is barry</srai>,reduction3.safe.aiml
0,WHAT IS BARRY,*,*,<srai>who is barry</srai>,reduction3.safe.aiml
0,WHO IS EHUD BARAK,*,*,<srai>who is barak</srai>,reduction3.safe.aiml
0,DO YOU KNOW AYSE,*,*,<srai>who is ayse</srai>,reduction3.safe.aiml
0,DO YOU KNOW AYN RAND,*,*,<srai>who is ayn rand</srai>,reduction3.safe.aiml
0,DO YOU KNOW ATATURK,*,*,<srai>who is ataturk</srai>,reduction3.safe.aiml
0,DO YOU KNOW ASK JEEVES,*,*,<srai>who is ask jeeves</srai>,reduction3.safe.aiml
0,TELL ME ABOUT ASK JEEVES,*,*,<srai>who is ask jeeves</srai>,reduction3.safe.aiml
0,WHAT IS ASK JEEVES,*,*,<srai>who is ask jeeves</srai>,reduction3.safe.aiml
0,DO YOU KNOW ASIMOV *,*,*,<srai>who is asimov</srai>,reduction3.safe.aiml
0,DO YOU KNOW ASIMOV,*,*,<srai>who is asimov</srai>,reduction3.safe.aiml
0,DO YOU KNOW ASIMO,*,*,<srai>who is asimo</srai>,reduction3.safe.aiml
0,DO YOU KNOW ARTY FISHAL,*,*,<srai>who is arty fishal</srai>,reduction3.safe.aiml
0,WHO IS ARTHUR CLARKE,*,*,<srai>who is arthur c clarke</srai>,reduction3.safe.aiml
0,DO YOU KNOW ARTHUR *,*,*,<srai>who is arthur <star/></srai>,reduction3.safe.aiml
0,TELL ME ABOUT ARTHUR *,*,*,<srai>who is arthur <star/></srai>,reduction3.safe.aiml
0,DO YOU KNOW ART *,*,*,<srai>who is art <star/></srai>,reduction3.safe.aiml
0,DO YOU KNOW ARNOLD *,*,*,<srai>who is arnold <star/></srai>,reduction3.safe.aiml
0,TELL ME ABOUT ARCHIMEDES,*,*,<srai>who is archimedes</srai>,reduction3.safe.aiml
